arbitro_principal	arbitro_principal_quadro_fifa	aux1_quadro_fifa	aux2_quadro_fifa	auxiliares	cidade	clubem	clubev	estado_m	estado_v	clássico	data	estadio	hora	ingressos_disponiveis	porcentagem_ingresso_vendido	observacoes	Publico_pagante	placar_mandante	placar_visitante	quarto_arbitro	quarto_arbitro_quadro_fifa	renda_bruta	renda_liq	ano	rodada	vitoria_mandante	empate_mandante	derrota_mandante	vitoria_visitante	empate_vvisitante	derrota_visitante	mandante_posicao_final_rodada	Visitante_posicao_final_rodada	mandante_posicao_inicio_rodada	Visitante_posicao_inicio_rodada	final de semana
André Luiz de Freitas Castro-GO	N	S	S	Fábio Pereira-TO_e_Janette Mara Arcanjo-MG	Rio de Janeiro	Flamengo-RJ	Atlético Paranaense-PR	RJ	PR	0	19/09	Maracanã	19h30	34289	46.7		16014	2	4	Leandro Newley Ferreira Belota-RJ	N	675745	160105.71	2013	22	0	0	1	1	0	0	16	3	13	3	0
Wagner Reway-MT	N	S	N	Kléber Lúcio Gil-SC_e_Evandro Gomes Ferreira-GO	Salvador	Bahia-BA	Internacional-RS	BA	RS	0	19/09	Arena Fonte Nova	21h00	9721	92.4		8979	2	0	Gleidson Santos Oliveira-BA	N	209970	-71015.65	2013	22	1	0	0	0	0	1	14	5	16	6	0
Ricardo Marques Ribeiro-MG	S	N	N	Pablo Almeida Costa-MG_e_Rafael Trombeta-PR	São Paulo	Portuguesa-SP	Náutico-PE	SP	PE	0	19/09	Canindé	21h00	2572	70.3		1808	3	0	Rodrigo Guarizo Ferreira do Amaral-SP	N	21520	-24103.45	2013	22	1	0	0	0	0	1	14	20	17	20	0
Wagner Reway-MT	N	N	N	José Eduardo Calza-RS_e_Bruno Salgado Rizo-SP	Rio de Janeiro	Fluminense-RJ	Coritiba-PR	RJ	PR	0	21/09	Maracanã	18h30	38086	75		28550	1	1	Pathrice Wallace Correa Maia-RJ	N	501840	232220.51	2013	23	0	1	0	0	1	0	12	11	12	9	1
Sandro Meira Ricci-PE	S	N	N	Thiago Gomes Brigido-CE_e_Anderson José de Moraes Coelho-SP	Salvador	Vitória-BA	Grêmio-RS	BA	RS	0	21/09	Manoel Barradas (Barradão)	21h00	13525	98.9		13378	0	0	Lúcio José Silva de Araújo-BA	N	147512	57062.19	2013	23	0	1	0	0	1	0	10	4	10	4	1
Marcos André Gomes-ES	N	N	N	Márcia B. Lopes Caetano-RO_e_Marco Antônio Moreira-GO	Novo Hamburgo	Internacional-RS	Portuguesa-SP	RS	SP	0	22/09	Vale	16h00	3012	100		3012	0	1	Márcio C. Brum Coruja-RS	N	95420	23398.49	2013	23	0	0	1	1	0	0	7	13	5	14	1
Wilson Luiz Seneme-SP	S	N	N	Rogério Pablos Zanardo-SP_e_Neuza Inês Back-SC	São Lourenço da Mata	Náutico-PE	Flamengo-RJ	PE	RJ	0	22/09	Arena Pernambuco	16h00	25700	54.5		14003	0	0	Gilberto Freire de Farias-PE	N	481815	414303.69	2013	23	0	1	0	0	1	0	20	16	20	16	1
Felipe Gomes da Silva-RJ	N	S	N	Rodrigo F. Henrique Correa-RJ_e_Luiz Antônio Muniz de Oliveira-RJ	São Paulo	Corinthians-SP	Cruzeiro-MG	SP	MG	0	22/09	Pacaembu	16h00	27318	99		27053	0	0	Raphael Claus-SP	N	846011	525180.68	2013	23	0	1	0	0	1	0	8	1	6	1	1
Leandro Pedro Vuaden-RS	S	N	N	Vicente Romano Neto-SP_e_Danilo Ricardo Simon Manis-SP	Rio de Janeiro	Botafogo-RJ	Bahia-BA	RJ	BA	0	22/09	Maracanã	16h00	39625	52.6		20826	1	2	Carlos Eduardo Nunes Braga-RJ	N	627180	254705.68	2013	23	0	0	1	1	0	0	2	13	2	14	1
Paulo Henrique Godoy Bezerra-SC	N	S	N	Fábio Pereira-TO_e_Marrubson Melo Freitas-DF	Goiânia	Goiás-GO	São Paulo-SP	GO	SP	0	22/09	Serra Dourada	16h00	36067	68.7		24789	1	0	Roberto Giovanny-GO	N	600145	408508.54	2013	23	1	0	0	0	0	1	9	15	11	13	1
Elmo Alves Resende Cunha-GO	N	N	N	José Antônio Chaves Franco Filho-RS_e_Marcos Santos Vieira-AM	Curitiba	Atlético Paranaense-PR	Ponte Preta-SP	PR	SP	0	22/09	Durival Britto e Silva	18h30	7305	92		6721	1	0	Leonardo Sígari Zanon-PR	N	86060	-44844.24	2013	23	1	0	0	0	0	1	2	19	3	19	1
Arilson Bispo da Anunciação-BA	N	S	N	Janette Mara Arcanjo-MG_e_Valdebranio da Silva-RO	Santos	Santos-SP	Criciúma-SC	SP	SC	0	22/09	Vila Belmiro	18h30	6977	73.8		5147	2	1	Marcelo Prieto Alfieri-SP	N	126376	9637.31	2013	23	1	0	0	0	0	1	6	16	7	16	1
André Luiz de Freitas Castro-GO	N	S	N	Fabrício Vilarinho da Silva-GO_e_Carlos Augusto Nogueira Júnior-SP	Belo Horizonte	Atlético Mineiro-MG	Vasco-RJ	MG	RJ	0	22/09	Independência	18h30	14587	88		12834	2	1	Igor Junio Benevenuto-MG	N	498495	162738.34	2013	23	1	0	0	0	0	1	5	18	7	18	1
Márcio Chagas da Silva-RS	N	S	N	Altemir Hausmann-RS_e_Daniel Luís Marques-SP	Goiânia	Goiás-GO	Fluminense-RJ	GO	RJ	0	28/09	Serra Dourada	18h30	24249	35.5		8610	1	2	Cléber Vaz-GO	N	187055	112290.15	2013	24	0	0	1	1	0	0	12	9	9	12	1
Cláudio Francisco Lima e Silva-SE	N	N	N	Aílton Farias-SE_e_Esdras Mariano de Lima-AL	São Lourenço da Mata	Náutico-PE	Coritiba-PR	PE	PR	0	28/09	Arena Pernambuco	18h30	17000	35.7		6065	3	0	Gilberto Rodrigues Castro Júnior-PE	N	156500	122767.09	2013	24	1	0	0	0	0	1	20	14	20	11	1
Francisco Carlos Nascimento-AL	S	S	N	Fábio Pereira-TO_e_Luiz Carlos Silva Teixeira-BA	Rio de Janeiro	Botafogo-RJ	Ponte Preta-SP	RJ	SP	0	28/09	Maracanã	21h00	22396	28		6272	0	1	Estevão Cunha da Trindade-RJ	N	260010	86519.54	2013	24	0	0	1	1	0	0	3	19	2	19	1
Raphael Claus-SP	N	N	N	Danilo Ricardo Simon Manis-SP_e_Bruno Salgado Rizo-SP	Campo Grande	Portuguesa-SP	Corinthians-SP	SP	SP	1	29/09	Morenão	16h00	12316	100		12316	4	0	Thiago de Alencar Gonzaga-SP	N	830425	447189.03	2013	24	1	0	0	0	0	1	10	11	13	8	1
Leandro Pedro Vuaden-RS	S	S	N	Marcelo Carvalho Van Gasse-SP_e_Rafael da Silva Alves-RS	Rio de Janeiro	Flamengo-RJ	Criciúma-SC	RJ	SC	0	29/09	Maracanã	16h00	52449	60.8		31895	4	1	Daniel de Souza Macedo-RJ	N	988450	189543.16	2013	24	1	0	0	0	0	1	15	17	16	16	1
Heber Roberto Lopes-SC	S	S	N	Alessandro Álvaro Rocha Mattos-BA_e_João Patrício de Araújo-GO	São Paulo	São Paulo-SP	Grêmio-RS	SP	RS	0	29/09	Morumbi	16h00	43667	94.2		41140	0	1	Márcio Henrique de Gois-SP	N	502961	350645.12	2013	24	0	0	1	1	0	0	16	2	15	4	1
Wilson Luiz Seneme-SP	S	S	N	Emerson Augusto de Carvalho-SP_e_Celso Barbosa de Oliveira-SP	Salvador	Bahia-BA	Vasco-RJ	BA	RJ	0	29/09	Arena Fonte Nova	16h00	32520	98.2		31946	0	0	Cosme Iran Sabino Júnior-BA	N	963960	518313.64	2013	24	0	1	0	0	1	0	13	17	13	18	1
Marcelo de Lima Henrique-RJ	S	N	N	Dibert Pedrosa Moisés-RJ_e_Luiz Cláudio Regazone-RJ	Belo Horizonte	Atlético Mineiro-MG	Santos-SP	MG	SP	0	29/09	Independência	18h30	12046	70.3		8465	3	1	Renato Cardoso Conceição-MG	N	260650	54864.65	2013	24	1	0	0	0	0	1	5	6	5	6	1
Wilton Pereira Sampaio-GO	S	S	N	Fabrício Vilarinho da Silva-GO_e_Carlos Berkenbrock-SC	Novo Hamburgo	Internacional-RS	Cruzeiro-MG	RS	MG	0	29/09	Vale	18h30	5434	100		5434	1	2	Diego Almeida Real-RS	N	161600	77440.12	2013	24	0	0	1	1	0	0	7	1	7	1	1
Paulo Henrique Godoy Bezerra-SC	N	S	N	Márcio Eustáquio Santiago-MG_e_Nadine Schramm Camara Bastos-SC	Curitiba	Atlético Paranaense-PR	Vitória-BA	PR	BA	0	29/09	Durival Britto e Silva	18h30	10517	95.4		10030	3	5	Leandro Júnior Hermes-PR	N	119520	-47046.69	2013	24	0	0	1	1	0	0	3	7	2	10	1
Pablo dos Santos Alves-ES	N	N	N	Vanderson Zanotti-ES_e_Luciano Roggenbaum-PR	Criciúma	Criciúma-SC	Atlético Mineiro-MG	SC	MG	0	25/09	Heriberto Hulse	19h30	9342	100		9342	1	1	Ronan Marques da Rosa-SC	N	104830	69910.94	2013	25	0	1	0	0	1	0	18	5	17	5	0
Antônio Denival de Morais-PR	N	N	N	Luís Cláudio Rodrigues da Costa-AM_e_Marcos Santos Vieira-AM	Campinas	Ponte Preta-SP	Náutico-PE	SP	PE	0	01/10	Moisés Lucarelli	19h30	13590	92.9		12625	1	2	Flávio Rodrigues de Souza-SP	N	44908	-17132.51	2013	25	0	0	1	1	0	0	19	20	19	20	0
Wilson Luiz Seneme-SP	S	N	N	Rogério Pablos Zanardo-SP_e_Carlos Augusto Nogueira Júnior-SP	Porto Alegre	Grêmio-RS	Atlético Paranaense-PR	RS	PR	0	02/10	Arena do Grêmio	19h30	19800	100		19800	1	0	Francisco de Paula dos Santos Silva Neto-RS	N	611860	489491.63	2013	25	1	0	0	0	0	1	2	3	2	3	0
Jean Pierre Gonçalves Lima-RS	N	S	N	Kléber Lúcio Gil-SC_e_Luiz Carlos Câmara Bezerra-RN	Belo Horizonte	Cruzeiro-MG	Portuguesa-SP	MG	SP	0	02/10	Mineirão	19h30	32241	99.3		32016	4	0	Wanderson Alves de Souza-MG	N	1346630	64217.18	2013	25	1	0	0	0	0	1	1	13	1	10	0
Sandro Meira Ricci-PE	S	S	S	Alessandro Álvaro Rocha Mattos-BA_e_Emerson Augusto de Carvalho-SP	Rio de Janeiro	Fluminense-RJ	Botafogo-RJ	RJ	RJ	1	02/10	Maracanã	21h00	51763	29.1		15067	1	1	Rodrigo Carvalhães de Miranda-RJ	N	357455	166559.34	2013	25	0	1	0	0	1	0	10	3	9	3	0
Dewson Fernando Freitas da Silva-PA	N	N	N	Cleriston Clay Barreto Rios-SE_e_Neuza Inês Back-SC	Salvador	Vitória-BA	Goiás-GO	BA	GO	0	02/10	Arena Fonte Nova	21h00	20675	99.1		20498	2	1	Lúcio José Silva de Araújo-BA	N	470952.5	150444.83	2013	25	1	0	0	0	0	1	7	12	7	12	0
Ricardo Marques Ribeiro-MG	S	S	S	Márcio Eustáquio Santiago-MG_e_Marcelo Carvalho Van Gasse-SP	Santos	Santos-SP	São Paulo-SP	SP	SP	1	02/10	Vila Belmiro	21h50	8657	90		7788	3	0	Rodrigo Guarizo Ferreira do Amaral-SP	N	210816	53652.61	2013	25	1	0	0	0	0	1	6	16	6	16	0
Paulo César Oliveira-SP	S	N	N	Cristhian Passos Sorence-GO_e_José Javel Silveira-RS	Curitiba	Coritiba-PR	Flamengo-RJ	PR	RJ	0	02/10	Couto Pereira	21h50	12287	100		12287	0	2	Fábio Filipus-PR	N	265357	17544.92	2013	25	0	0	1	1	0	0	15	11	14	15	0
André Luiz de Freitas Castro-GO	N	S	N	Rodrigo Pereira Joia-RJ_e_Fabiano da Silva Ramires-ES	Mogi Mirim	Corinthians-SP	Bahia-BA	SP	BA	0	02/10	Romildo Vitor Gomes Ferreira	21h50	9917	100		9917	2	0	Flávio Rodrigues Guerra-SP	N	223758	93250.92	2013	25	1	0	0	0	0	1	8	14	11	13	0
Luiz Flávio de Oliveira-SP	N	N	N	Bruno Boschilla-PR_e_Marrubson Melo Freitas-DF	Macaé	Vasco-RJ	Internacional-RS	RJ	RS	0	03/10	Cláudio Moacyr	21h00	10102	82.5		8336	3	1	Leonardo Garcia Cavaleiro-RJ	N	127280	29878.24	2013	25	1	0	0	0	0	1	16	9	17	7	0
Wilton Pereira Sampaio-GO	S	S	S	Emerson Augusto de Carvalho-SP_e_Marcelo Carvalho Van Gasse-SP	Rio de Janeiro	Botafogo-RJ	Grêmio-RS	RJ	RS	0	05/10	Maracanã	18h30	27283	40.2		10959	0	1	Leandro Newley Ferreira Belota-RJ	N	356995	103329.32	2013	26	0	0	1	1	0	0	4	2	3	2	1
Anderson Daronco-RS	N	S	N	Rodrigo F. Henrique Correa-RJ_e_José Eduardo Calza-RS	São Paulo	São Paulo-SP	Vitória-BA	SP	BA	0	05/10	Morumbi	21h00	26115	85.3		22285	3	2	Thiago Duarte Peixoto-SP	N	250953	144253.75	2013	26	1	0	0	0	0	1	15	7	16	7	1
Jaílson Macedo Freitas-BA	N	S	S	Rodrigo Pereira Joia-RJ_e_Fábio Pereira-TO	Belo Horizonte	Atlético Mineiro-MG	Corinthians-SP	MG	SP	0	06/10	Independência	16h00	17893	90.6		16204	0	0	Igor Junio Benevenuto-MG	N	610680	241948.47	2013	26	0	1	0	0	1	0	5	9	5	8	1
Wilson Luiz Seneme-SP	S	S	N	Márcio Eustáquio Santiago-MG_e_Rogério Pablos Zanardo-SP	Caxias do Sul	Internacional-RS	Fluminense-RJ	RS	RJ	0	06/10	Centenário	16h00	7637	100		7637	1	0	Luís Teixeira Rocha-RS	N	211200	138760.41	2013	26	1	0	0	0	0	1	7	11	9	10	1
Ricardo Marques Ribeiro-MG	S	N	N	Marcelo Bertanha Barison-RS_e_Rafael da Silva Alves-RS	Brasília	Flamengo-RJ	Vasco-RJ	RJ	RJ	1	06/10	Mané Garrincha	16h00	34597	100		34597	1	1	Ademário Neves-DF	N	2054140	469874.57 469874.57	2013	26	0	1	0	0	1	0	12	17	11	16	1
Sandro Meira Ricci-PE	S	S	N	Fabrício Vilarinho da Silva-GO_e_Bruno Salgado Rizo-SP	Curitiba	Atlético Paranaense-PR	Coritiba-PR	PR	PR	1	06/10	Durival Britto e Silva	16h00	13790	98.3		13551	2	1	Adriano Milczvski-PR	N	193230	-14589.19	2013	26	1	0	0	0	0	1	3	16	3	15	1
Dewson Fernando Freitas da Silva-PA	N	N	N	Edílson Frasão Pereira-TO_e_Luís Cláudio Rodrigues da Costa-AM	São Lourenço da Mata	Náutico-PE	Cruzeiro-MG	PE	MG	0	06/10	Arena Pernambuco	16h00	25700	76.2		19591	1	4	Sebastião Rufino Ribeiro Filho-PE	N	528715	457246.79	2013	26	0	0	1	1	0	0	20	1	20	1	1
Péricles Bassols Pegado Cortez-RJ	S	N	N	Bruno Boschilla-PR_e_Moisés Aparecido de Souza-PR	São Paulo	Portuguesa-SP	Santos-SP	SP	SP	1	06/10	Canindé	18h30	10190	78.3		7979	3	0	José Cláudio Rocha Filho-SP	N	211730	120626.52	2013	26	1	0	0	0	0	1	9	6	13	6	1
Pablo dos Santos Alves-ES	N	N	N	Marcos Antônio da Silva Brigido-CE_e_Arnaldo Rodrigues de Souza-CE	Salvador	Bahia-BA	Ponte Preta-SP	BA	SP	0	06/10	Arena Fonte Nova	18h30	12129	77.9		9448	1	1	Marielson Alves Silva-BA	N	200030	-93387.5	2013	26	0	1	0	0	1	0	14	19	14	19	1
Cláudio Francisco Lima e Silva-SE	N	N	N	Cleriston Clay Barreto Rios-SE_e_Aelson Mariano Campelo Gomes-MA	Goiânia	Goiás-GO	Criciúma-SC	GO	SC	0	06/10	Serra Dourada	18h30	16222	35.2		5704	1	1	Bruno Rezende-GO	N	108780	58781.86	2013	26	0	1	0	0	1	0	13	18	12	18	1
Alício Pena Júnior-MG	N	N	N	Márcia B. Lopes Caetano-RO_e_Marrubson Melo Freitas-DF	Curitiba	Coritiba-PR	Santos-SP	PR	SP	0	09/10	Couto Pereira	19h30	11721	100		11721	1	0	Rafael Traci-PR	N	189227	-55422.49	2013	27	1	0	0	0	0	1	16	7	16	6	0
Elmo Alves Resende Cunha-GO	N	N	N	Cleriston Clay Barreto Rios-SE_e_Celso Barbosa de Oliveira-SP	Porto Alegre	Grêmio-RS	Criciúma-SC	RS	SC	0	09/10	Arena do Grêmio	19h30	16423	100		16423	1	2	Jean Pierre Gonçalves Lima-RS	N	502468	395062.74	2013	27	0	0	1	1	0	0	2	18	2	18	0
Felipe Gomes da Silva-RJ	N	N	N	Neuza Inês Back-SC_e_Lincoln Ribeiro Taques-MT	Campinas	Ponte Preta-SP	Atlético Mineiro-MG	SP	MG	0	09/10	Moisés Lucarelli	21h00	7561	81		6127	2	0	Antônio Rogério Batista do Prado-SP	N	37723	-22635.16	2013	27	1	0	0	0	0	1	19	5	19	5	0
Marcelo de Lima Henrique-RJ	S	S	S	Rodrigo Pereira Joia-RJ_e_Fábio Pereira-TO	Salvador	Bahia-BA	Vitória-BA	BA	BA	1	09/10	Arena Fonte Nova	21h00	29238	96.5		28225	2	0	Johnn Herbert Alves Bispo-BA	N	850622.5	345791.24	2013	27	1	0	0	0	0	1	13	7	14	7	0
Marcos André Gomes-ES	N	N	N	Luiz Carlos Câmara Bezerra-RN_e_Broney Machado-PB	São Lourenço da Mata	Náutico-PE	Botafogo-RJ	PE	RJ	0	09/10	Arena Pernambuco	21h50	18300	30.9		5658	1	3	Cláudio Mercante Júnior-PE	N	148740	116036.44	2013	27	0	0	1	1	0	0	20	4	20	4	0
Wagner do Nascimento Magalhães-RJ	N	N	N	Luiz Antônio Muniz de Oliveira-RJ_e_Luiz Cláudio Regazone-RJ	Florianópolis	Vasco-RJ	Fluminense-RJ	RJ	RJ	1	09/10	Ressacada	21h50	8245	100		8245	1	0	Jefferson Schmidt-SC	N	269470	69380.81	2013	27	1	0	0	0	0	1	17	14	17	11	0
Leandro Pedro Vuaden-RS	S	S	S	Márcio Eustáquio Santiago-MG_e_Rodrigo F. Henrique Correa-RJ	Mogi Mirim	Corinthians-SP	Atlético Paranaense-PR	SP	PR	0	09/10	Romildo Vitor Gomes Ferreira	21h50	15691	99.3		15581	0	0	Márcio Henrique de Gois-SP	N	372723	225298.87	2013	27	0	1	0	0	1	0	11	3	9	3	0
Jaílson Macedo Freitas-BA	N	N	N	Ivan Carlos Bohn-PR_e_Rafael Trombeta-PR	Belo Horizonte	Cruzeiro-MG	São Paulo-SP	MG	SP	0	09/10	Mineirão	21h50	40884	99.7		40743	0	2	Cleisson Veloso Pereira-MG	N	1899595	3610.03	2013	27	0	0	1	1	0	0	1	15	1	15	0
Rodrigo Batista Raposo-DF	N	S	N	Janette Mara Arcanjo-MG_e_Marcos Santos Vieira-AM	São Paulo	Portuguesa-SP	Goiás-GO	SP	GO	0	10/10	Canindé	19h30	4398	76.2		3353	1	2	Leandro Bizzio Marinho-SP	N	67160	15580.65	2013	27	0	0	1	1	0	0	11	10	9	13	0
Raphael Claus-SP	N	N	N	Guilherme Dias Camilo-MG_e_Danilo Ricardo Simon Manis-SP	Rio de Janeiro	Flamengo-RJ	Internacional-RS	RJ	RS	0	10/10	Maracanã	21h00	50647	39.2		19829	2	1	Pathrice Wallace Correa Maia-RJ	N	634015	121923.63	2013	27	1	0	0	0	0	1	6	7	12	7	0
Alício Pena Júnior-MG	N	N	N	Bruno Boschilla-PR_e_Herman Brumel Vani-SP	Rio de Janeiro	Fluminense-RJ	Grêmio-RS	RJ	RS	0	12/10	Maracanã	18h30	37486	35.4		13252	1	1	Wagner dos Santos Rosa-RJ	N	233440	72519.94	2013	28	0	1	0	0	1	0	13	2	14	2	1
Francisco de Almeida Filho-CE	N	N	N	Clóvis Amaral da Silva-PE_e_Carlos Jorge Titara da Rocha-AL	Salvador	Vitória-BA	Coritiba-PR	BA	PR	0	12/10	Manoel Barradas (Barradão)	18h30	9625	97.8		9415	2	1	Gleidson Santos Oliveira-BA	N	79652	5619.54	2013	28	1	0	0	0	0	1	8	16	7	16	1
Marcelo Aparecido Ribeiro de Souza-SP	N	N	N	Gustavo Rodrigues de Oliveira-SP_e_Fabrício Porfirio de Moura-SP	São Paulo	Santos-SP	Ponte Preta-SP	SP	SP	1	12/10	Pacaembu	21h00	11178	64.7		7230	2	1	José Cláudio Rocha Filho-SP	N	241720	20434.78	2013	28	1	0	0	0	0	1	7	19	7	19	1
Wilson Luiz Seneme-SP	S	N	N	Danilo Ricardo Simon Manis-SP_e_Celso Barbosa de Oliveira-SP	São Paulo	São Paulo-SP	Corinthians-SP	SP	SP	1	13/10	Morumbi	16h00	53249	94.4		50282	0	0	Robério Pereira Pires-SP	N	596307	428218.75	2013	28	0	1	0	0	1	0	14	11	15	11	1
André Luiz de Freitas Castro-GO	N	N	N	Cristhian Passos Sorence-GO_e_Guilherme Dias Camilo-MG	Criciúma	Criciúma-SC	Vasco-RJ	SC	RJ	0	13/10	Heriberto Hulse	16h00	13158	100		13158	3	2	Ronan Marques da Rosa-SC	N	233640	184777.9	2013	28	1	0	0	0	0	1	17	18	18	17	1
Emerson de Almeida Ferreira-MG	N	N	N	Eberval Lodetti-SC_e_Gean Carlos Menezes de Oliveira-RR	Caxias do Sul	Internacional-RS	Náutico-PE	RS	PE	0	13/10	Centenário	16h00	3672	100		3672	4	1	Márcio C. Brum Coruja-RS	N	77070	22753.84	2013	28	1	0	0	0	0	1	6	20	7	20	1
Luiz Flávio de Oliveira-SP	N	S	N	Janette Mara Arcanjo-MG_e_Pablo Almeida Costa-MG	Belo Horizonte	Atlético Mineiro-MG	Cruzeiro-MG	MG	MG	1	13/10	Independência	16h00	17387	88.4		15368	1	0	Flávio Henrique Coutinho Teixeira-MG	N	574655	214885.31	2013	28	1	0	0	0	0	1	5	1	5	1	1
Grazianni Maciel Rocha-RJ	N	N	N	Wagner de Almeida Santos-RJ_e_Luiz Antônio Muniz de Oliveira-RJ	Rio de Janeiro	Botafogo-RJ	Flamengo-RJ	RJ	RJ	1	13/10	Maracanã	18h30	52894	44.8		23718	2	1	Pathrice Wallace Correa Maia-RJ	N	1346700	657010.83	2013	28	1	0	0	0	0	1	2	10	4	6	1
Raphael Claus-SP	N	N	N	Márcio Gleidson Correia Dias-PA_e_Rener Santos de Carvalho-AC	Goiânia	Goiás-GO	Bahia-BA	GO	BA	0	13/10	Serra Dourada	18h30	21681	39.5		8561	3	1	Osimar Moreira-GO	N	138090	79780.59	2013	28	1	0	0	0	0	1	9	14	10	13	1
Dewson Fernando Freitas da Silva-PA	N	N	N	Cleriston Clay Barreto Rios-SE_e_Neuza Inês Back-SC	Curitiba	Atlético Paranaense-PR	Portuguesa-SP	PR	SP	0	13/10	Durival Britto e Silva	18h30	10232	94.3		9647	1	0	Rodolpho Toski Marques-PR	N	108920	-46295.73	2013	28	1	0	0	0	0	1	4	12	3	11	1
André Luiz de Freitas Castro-GO	N	N	N	Bruno Pires-GO_e_Ricardo Chianca-PE	Santos	Santos-SP	Internacional-RS	SP	RS	0	16/10	Vila Belmiro	19h30	5245	66.5		3486	0	0	Leandro Bizzio Marinho-SP	N	99863	-13381.84	2013	29	0	1	0	0	1	0	6	7	7	6	0
Paulo Henrique Godoy Bezerra-SC	N	S	N	Fabrício Vilarinho da Silva-GO_e_Nadine Schramm Camara Bastos-SC	Belo Horizonte	Cruzeiro-MG	Fluminense-RJ	MG	RJ	0	16/10	Mineirão	19h30	31718	99.5		31564	1	0	Emerson de Almeida Ferreira-MG	N	1270930	149070.92	2013	29	1	0	0	0	0	1	1	15	1	13	0
Cleisson Veloso Pereira-MG	N	N	N	Fabiano da Silva Ramires-ES_e_Ivan Carlos Bohn-PR	Criciúma	Criciúma-SC	Portuguesa-SP	SC	SP	0	16/10	Heriberto Hulse	21h00	11377	100		11377	1	3	Edmundo Alves do Nascimento-SC	N	136120	98269.89	2013	29	0	0	1	1	0	0	17	12	17	12	0
Fabrício Neves Correa-RS	N	N	N	Cleriston Clay Barreto Rios-SE_e_Katiúscia Mayer Berger-ES	Campinas	Ponte Preta-SP	Coritiba-PR	SP	PR	0	16/10	Moisés Lucarelli	21h00	3771	82.3		3104	1	0	José Cláudio Rocha Filho-SP	N	20715	-38847.98	2013	29	1	0	0	0	0	1	19	16	19	16	0
Elmo Alves Resende Cunha-GO	N	N	N	Neuza Inês Back-SC_e_João Patrício de Araújo-GO	São Paulo	São Paulo-SP	Náutico-PE	SP	PE	0	16/10	Morumbi	21h00	18858	79.2		14942	3	0	Antônio Rogério Batista do Prado-SP	N	159515	66614.66	2013	29	1	0	0	0	0	1	13	20	14	20	0
Sandro Meira Ricci-PE	S	S	N	Kléber Lúcio Gil-SC_e_Clóvis Amaral da Silva-PE	Porto Alegre	Grêmio-RS	Corinthians-SP	RS	SP	0	16/10	Arena do Grêmio	21h50	15352	100		15352	1	0	Anderson Daronco-RS	N	454454	349284.51	2013	29	1	0	0	0	0	1	2	10	2	11	0
Célio Amorim-SC	N	N	N	Rogério Pablos Zanardo-SP_e_Daniel Paulo Ziolli-SP	Curitiba	Atlético Paranaense-PR	Atlético Mineiro-MG	PR	MG	0	16/10	Durival Britto e Silva	21h50	6811	100		6811	1	0	Edivaldo Elias da Silva-PR	N	81730	-41138.78	2013	29	1	0	0	0	0	1	2	5	4	5	0
Wilton Pereira Sampaio-GO	S	N	N	Bruno Boschilla-PR_e_Bruno Salgado Rizo-SP	Rio de Janeiro	Flamengo-RJ	Bahia-BA	RJ	BA	0	16/10	Maracanã	21h50	43958	19.3		8474	2	1	Leandro Newley Ferreira Belota-RJ	N	361830	64765.28	2013	29	1	0	0	0	0	1	11	14	10	14	0
Wilson Luiz Seneme-SP	S	S	S	Emerson Augusto de Carvalho-SP_e_Márcio Eustáquio Santiago-MG	Macaé	Vasco-RJ	Goiás-GO	RJ	GO	0	17/10	Cláudio Moacyr	19h30	10149	63.7		6460	0	2	Bruno Arleu de Araújo-RJ	N	94060	-3526.29	2013	29	0	0	1	1	0	0	18	7	18	9	0
Alício Pena Júnior-MG	N	S	S	Altemir Hausmann-RS_e_Fábio Pereira-TO	Salvador	Vitória-BA	Botafogo-RJ	BA	RJ	0	17/10	Manoel Barradas (Barradão)	21h00	17359	98.4		17086	1	0	Lúcio José Silva de Araújo-BA	N	207042	96183.4	2013	29	1	0	0	0	0	1	9	4	8	2	0
Ricardo Marques Ribeiro-MG	S	S	N	Janette Mara Arcanjo-MG_e_Fabiano da Silva Ramires-ES	Rio de Janeiro	Fluminense-RJ	Ponte Preta-SP	RJ	SP	0	19/10	Maracanã	16h00	38325	38.9		14899	1	1	Eduardo Cordeiro Guimarães-RJ	N	249620	93457.11	2013	30	0	1	0	0	1	0	14	19	15	19	1
Rodrigo Nunes de Sá-RJ	N	N	N	Enoque Costa Pacheco-AP_e_Francisco Rudson Rocha Aquino-CE	São Lourenço da Mata	Náutico-PE	Santos-SP	PE	SP	0	19/10	Arena Pernambuco	18h30	16500	27.2		4494	1	5	Gleydson Leite-PE	N	116980	87862.74	2013	30	0	0	1	1	0	0	20	6	20	6	1
Anderson Daronco-RS	N	N	N	Bruno Boschilla-PR_e_Paulo César Silva Faria-MT	Itú	Corinthians-SP	Criciúma-SC	SP	SC	0	19/10	Novelli Júnior	21h00	14788	100		14788	1	0	Vinícius Furlan-SP	N	392295	239499.41	2013	30	1	0	0	0	0	1	8	18	10	17	1
Sandro Meira Ricci-PE	S	N	N	Cleriston Clay Barreto Rios-SE_e_Pablo Almeida Costa-MG	Salvador	Bahia-BA	São Paulo-SP	BA	SP	0	20/10	Arena Fonte Nova	16h00	25143	98.5		24765	0	1	Manoel Nunes Lopo Garrido-BA	N	713460	316591.03	2013	30	0	0	1	1	0	0	16	11	14	13	1
Marcelo de Lima Henrique-RJ	S	S	N	Emerson Augusto de Carvalho-SP_e_Celso Barbosa de Oliveira-SP	Caxias do Sul	Internacional-RS	Grêmio-RS	RS	RS	1	20/10	Centenário	16h00	15273	100		15273	2	2	Luís Teixeira Rocha-RS	N	453815	353026.81	2013	30	0	1	0	0	1	0	9	2	7	2	1
Leandro Pedro Vuaden-RS	S	S	N	Altemir Hausmann-RS_e_Danilo Ricardo Simon Manis-SP	Belo Horizonte	Atlético Mineiro-MG	Flamengo-RJ	MG	RJ	0	20/10	Independência	16h00	16478	86.2		14203	1	0	Cleisson Veloso Pereira-MG	N	386495	136123.91	2013	30	1	0	0	0	0	1	5	13	5	11	1
Péricles Bassols Pegado Cortez-RJ	S	N	N	Vicente Romano Neto-SP_e_Anderson José de Moraes Coelho-SP	Goiânia	Goiás-GO	Atlético Paranaense-PR	GO	PR	0	20/10	Serra Dourada	16h00	27380	50.1		13713	3	0	Fabrício Nery Trindade-GO	N	203510	125037.15	2013	30	1	0	0	0	0	1	6	3	7	2	1
Wilton Pereira Sampaio-GO	S	S	N	Fabrício Vilarinho da Silva-GO_e_Rafael da Silva Alves-RS	Rio de Janeiro	Botafogo-RJ	Vasco-RJ	RJ	RJ	1	20/10	Maracanã	18h30	54555	18		9795	2	2	Leonardo Garcia Cavaleiro-RJ	N	518430	218222.47	2013	30	0	1	0	0	1	0	4	17	4	18	1
Jaílson Macedo Freitas-BA	N	N	N	Carlos Augusto Nogueira Júnior-SP_e_Bruno Salgado Rizo-SP	Curitiba	Coritiba-PR	Cruzeiro-MG	PR	MG	0	20/10	Couto Pereira	18h30	14402	100		14402	2	1	Leandro Júnior Hermes-PR	N	283752.5	13490.09	2013	30	1	0	0	0	0	1	14	1	16	1	1
Edivaldo Elias da Silva-PR	N	S	N	Katiúscia Mayer Berger-ES_e_Luiz Cláudio Regazone-RJ	São Paulo	Portuguesa-SP	Vitória-BA	SP	BA	0	20/10	Canindé	18h30	5293	69.7		3687	1	1	Flávio Rodrigues de Souza-SP	N	73950	17867.66	2013	30	0	1	0	0	1	0	12	9	12	9	1
Wilton Pereira Sampaio-GO	S	N	N	Márcia B. Lopes Caetano-RO_e_José Antônio Chaves Franco Filho-RS	Belo Horizonte	Cruzeiro-MG	Criciúma-SC	MG	SC	0	26/10	Mineirão	18h30	38579	99.5		38378	5	3	Renato Cardoso Conceição-MG	N	1769440	150741.37	2013	31	1	0	0	0	0	1	1	19	1	18	1
Márcio Chagas da Silva-RS	N	S	N	Kléber Lúcio Gil-SC_e_Marrubson Melo Freitas-DF	Rio de Janeiro	Botafogo-RJ	Atlético Mineiro-MG	RJ	MG	0	26/10	Maracanã	18h30	28647	22.6		6472	1	0	Antônio Frederico de Carvalho Schneider-RJ	N	176180	-29063.18	2013	31	1	0	0	0	0	1	2	7	4	5	1
Péricles Bassols Pegado Cortez-RJ	S	N	N	Bruno Boschilla-PR_e_Luiz Antônio Muniz de Oliveira-RJ	Caxias do Sul	Internacional-RS	São Paulo-SP	RS	SP	0	27/10	Centenário	16h00	5603	100		5603	2	3	Roger Goulart-RS	N	122660	60210.99	2013	31	0	0	1	1	0	0	10	8	9	11	1
Leandro Pedro Vuaden-RS	S	N	N	Fábio Rogério Baesteiro-SP_e_Tatiane Sacilotti dos Santos Camargo-SP	Araraquara	Corinthians-SP	Santos-SP	SP	SP	1	27/10	Arena Fonte Luminosa	16h00	17949	100		17949	1	1	Thiago Duarte Peixoto-SP	N	587694	377160.09	2013	31	0	1	0	0	1	0	11	6	8	6	1
Anderson Daronco-RS	N	S	N	Márcio Eustáquio Santiago-MG_e_Arnaldo Rodrigues de Souza-CE	Fortaleza	Portuguesa-SP	Flamengo-RJ	SP	RJ	0	27/10	Castelão	16h00	21967	100		21967	0	0	José Cleuton Souza Lima-CE	N	890950	384561.01	2013	31	0	1	0	0	1	0	12	13	12	13	1
Sandro Meira Ricci-PE	S	N	N	Guilherme Dias Camilo-MG_e_Marcelo Bertanha Barison-RS	Campinas	Ponte Preta-SP	Vasco-RJ	SP	RJ	0	27/10	Moisés Lucarelli	16h00	14354	93		13349	2	1	Marcelo Aparecido Ribeiro de Souza-SP	N	38967	-25266.24	2013	31	1	0	0	0	0	1	17	18	19	17	1
Francisco Carlos Nascimento-AL	S	N	N	Carlos Jorge Titara da Rocha-AL_e_Cristhian Passos Sorence-GO	Salvador	Bahia-BA	Atlético Paranaense-PR	BA	PR	0	27/10	Arena Fonte Nova	16h00	7621	84.2		6415	1	1	Gleidson Santos Oliveira-BA	N	140035	-137458.36	2013	31	0	1	0	0	1	0	15	3	16	3	1
André Luiz de Freitas Castro-GO	N	N	N	Rogério Pablos Zanardo-SP_e_Danilo Ricardo Simon Manis-SP	Curitiba	Coritiba-PR	Grêmio-RS	PR	RS	0	27/10	Couto Pereira	18h30	19203	100		19203	4	0	Antônio Denival de Morais-PR	N	425347	126747.4	2013	31	1	0	0	0	0	1	14	3	14	2	1
Emerson de Almeida Ferreira-MG	N	N	N	Neuza Inês Back-SC_e_Edina Alves Batista-PR	São Lourenço da Mata	Náutico-PE	Goiás-GO	PE	GO	0	27/10	Arena Pernambuco	18h30	16700	16.1		2693	0	2	Gilberto Freire de Farias-PE	N	68645	44495.54	2013	31	0	0	1	1	0	0	20	5	20	6	1
Fabrício Neves Correa-RS	N	N	N	Cleriston Clay Barreto Rios-SE_e_Flávio Gomes Barroca-RN	Rio de Janeiro	Fluminense-RJ	Vitória-BA	RJ	BA	0	27/10	Maracanã	18h30	44038	52.9		23283	2	3	Bruno Arleu de Araújo-RJ	N	231160	79798.12	2013	31	0	0	1	1	0	0	15	9	14	9	1
André Luiz de Freitas Castro-GO	N	N	N	Rogério Pablos Zanardo-SP_e_Vicente Romano Neto-SP	São Paulo	São Paulo-SP	Portuguesa-SP	SP	SP	1	02/11	Morumbi	19h30	50802	100		50802	2	1	Marcelo Prieto Alfieri-SP	N	623129	463801.1	2013	32	1	0	0	0	0	1	9	13	8	12	1
Márcio Chagas da Silva-RS	N	N	N	Cleriston Clay Barreto Rios-SE_e_Fabiano da Silva Ramires-ES	Macaé	Vasco-RJ	Coritiba-PR	RJ	PR	0	02/11	Cláudio Moacyr	19h30	9656	55.1		5318	2	1	Pathrice Wallace Correa Maia-RJ	N	75140	-23060.61	2013	32	1	0	0	0	0	1	17	14	18	14	1
Wagner Reway-MT	N	N	N	Márcio Gleidson Correia Dias-PA_e_Sérgio Henrique Campelo Gomes-MA	Belo Horizonte	Atlético Mineiro-MG	Náutico-PE	MG	PE	0	02/11	Independência	21h00	15832	83.7		13255	5	0	Marcos Vinícius de Sá dos Santos-MG	N	350705	148896.39	2013	32	1	0	0	0	0	1	5	20	7	20	1
