arbitro_principal	arbitro_principal_quadro_fifa	aux1_quadro_fifa	aux2_quadro_fifa	auxiliares	cidade	clubem	clubev	estado_m	estado_v	clássico	data	estadio	hora	ingressos_disponiveis	porcentagem_ingresso_vendido	observacoes	Publico_pagante	placar_mandante	placar_visitante	quarto_arbitro	quarto_arbitro_quadro_fifa	renda_bruta	renda_liq	ano	rodada	vitoria_mandante	empate_mandante	derrota_mandante	vitoria_visitante	empate_vvisitante	derrota_visitante	mandante_posicao_final_rodada	Visitante_posicao_final_rodada	mandante_posicao_inicio_rodada	Visitante_posicao_inicio_rodada	final de semana
Leandro Pedro Vuaden-RS	S	N	N	José Javel Silveira-RS_e_Rafael da Silva Alves-RS	São Paulo	São Paulo-SP	Fluminense-RJ	SP	RJ	0	05/07	Morumbi	16h00	16469	63.7		10497	0	0	Marcelo Aparecido Ribeiro de Souza-SP	N	344620	150578.55	2015	11	0	1	0	0	1	0	8	4	9	3	1
Felipe Gomes da Silva-PR	N	N	N	Rafael Trombeta-PR_e_Luciano Roggenbaum-PR	Santos	Santos-SP	Grêmio-RS	SP	RS	0	05/07	Vila Belmiro	16h00	6010	82.2		4942	1	3	Antônio Rogério Batista do Prado-SP	N	136330	677.57	2015	11	0	0	1	1	0	0	16	2	15	4	1
Heber Roberto Lopes-SC	S	S	S	Kléber Lúcio Gil-SC_e_Nadine Schramm Camara Bastos-SC	Goiânia	Goiás-GO	Corinthians-SP	GO	SP	0	05/07	Serra Dourada	16h00	9444	99.9		9438	0	0	Bruno Rezende-GO	N	388550	287512.19	2015	11	0	1	0	0	1	0	14	6	16	7	1
Vinícius Gonçalves Dias Araujo-SP	N	N	N	Vicente Romano Neto-SP_e_Alex Alexandrino-SP	Cuiabá	Ponte Preta-SP	Palmeiras-SP	SP	SP	1	05/07	Arena Pantanal	18h30	11074	100		11074	0	2	Wagner Reway-MT	N	800370	558539.3	2015	11	0	0	1	1	0	0	9	5	8	6	1
Jaílson Macedo Freitas-BA	N	S	N	Alessandro Álvaro Rocha Mattos-BA_e_Eduardo Gonçalves da Cruz-MS	Rio de Janeiro	Flamengo-RJ	Figueirense-SC	RJ	SC	0	05/07	Maracanã	18h30	20329	88.5		17986	1	2	Antônio Frederico de Carvalho Schneider-RJ	N	589932.5	90040.9	2015	11	0	0	1	1	0	0	16	12	16	11	1
Raphael Claus-SP	S	S	N	Bruno Boschilla-PR_e_Rogério Pablos Zanardo-SP	Porto Alegre	Internacional-RS	Atlético Mineiro-MG	RS	MG	0	05/07	Beira-Rio	18h30	16612	100		16612	1	3	Roger Goulart-RS	N	438900	247571.13	2015	11	0	0	1	1	0	0	14	1	13	1	1
Péricles Bassols Pegado Cortez-RJ	S	S	N	Rodrigo F. Henrique Correa-RJ_e_Luiz Cláudio Regazone-RJ	Curitiba	Coritiba-PR	Ponte Preta-SP	PR	SP	0	08/07	Couto Pereira	19h30	7515	100		7515	0	0	Adriano Milczvski-PR	N	95875	-86793.06	2015	12	0	1	0	0	1	0	18	9	18	9	0
Anderson Daronco-RS	S	N	N	Marcelo Bertanha Barison-RS_e_Rafael da Silva Alves-RS	Goiânia	Goiás-GO	Santos-SP	GO	SP	0	08/07	Serra Dourada	19h30	1830	99.9		1829	4	1	Fabrício Nery Trindade-GO	N	50925	20000.37	2015	12	1	0	0	0	0	1	12	17	14	16	0
Flávio Rodrigues Guerra-SP	N	S	S	Emerson Augusto de Carvalho-SP_e_Marcelo Carvalho Van Gasse-SP	Chapecó	Chapecoense-SC	Grêmio-RS	SC	RS	0	08/07	Arena Condá	19h30	13916	100		13916	1	0	Evandro Bender-SC	N	466180	383433.84	2015	12	1	0	0	0	0	1	9	5	10	2	0
Igor Junio Benevenuto-MG	N	S	N	Bruno Boschilla-PR_e_Pablo Almeida Costa-MG	São Paulo	Palmeiras-SP	Avaí-SC	SP	SC	0	08/07	Allianz Parque	21h00	37530	100		37530	3	0	Rodrigo Guarizo Ferreira do Amaral-SP	N	2405755	1769886.48	2015	12	1	0	0	0	0	1	3	15	5	13	0
Marcelo de Lima Henrique-PE	N	N	S	Carlos Berkenbrock-SC_e_Neuza Inês Back-SC	Florianópolis	Figueirense-SC	Joinville-SC	SC	SC	1	08/07	Orlando Scarpelli	21h00	3891	100		3891	0	2	Rodrigo D'Alonso Ferreira-SC	N	45230	15328.34	2015	12	0	0	1	1	0	0	12	20	12	20	0
Leandro Pedro Vuaden-RS	S	N	N	José Javel Silveira-RS_e_Eduardo Gonçalves da Cruz-MS	Brasília	Vasco-RJ	São Paulo-SP	RJ	SP	0	08/07	Mané Garrincha	22h00	27071	58.4		15812	0	4	Rodrigo Batista Raposo-DF	N	1274000	605331.64	2015	12	0	0	1	1	0	0	19	7	18	8	0
Wilton Pereira Sampaio-GO	S	S	N	Fábio Pereira-TO_e_Bruno Pires-GO	Porto Alegre	Internacional-RS	Flamengo-RJ	RS	RJ	0	08/07	Beira-Rio	22h00	10937	100		10937	1	2	Luís Teixeira Rocha-RS	N	265260	112699.33	2015	12	0	0	1	1	0	0	15	14	14	16	0
Elmo Alves Resende Cunha-GO	N	S	N	Fabrício Vilarinho da Silva-GO_e_Jesmar Benedito Miranda de Paula-GO	Belo Horizonte	Atlético Mineiro-MG	Sport-PE	MG	PE	0	08/07	Mineirão	22h00	51254	98.9		50684	2	1	Renato Cardoso Conceição-MG	N	1671325	513238.95	2015	12	1	0	0	0	0	1	1	3	1	2	0
Ricardo Marques Ribeiro-MG	S	N	S	Márcio Eustáquio Santiago-MG_e_Guilherme Dias Camilo-MG	São Paulo	Corinthians-SP	Atlético Paranaense-PR	SP	PR	0	09/07	Arena Corinthians	19h30	32442	100		32442	2	0	Rodrigo Guarizo Ferreira do Amaral-SP	N	1861072.76	1225414.03	2015	12	1	0	0	0	0	1	5	8	6	6	0
Heber Roberto Lopes-SC	S	S	N	Kléber Lúcio Gil-SC_e_Sidmar dos Santos Meurer-PR	Rio de Janeiro	Fluminense-RJ	Cruzeiro-MG	RJ	MG	0	09/07	Maracanã	21h00	16651	86.1		14339	1	0	Rodrigo Carvalhães de Miranda-RJ	N	589570	160215.56	2015	12	1	0	0	0	0	1	2	11	4	11	0
André Luiz de Freitas Castro-GO	N	S	N	Fabrício Vilarinho da Silva-GO_e_Bruno Pires-GO	Santos	Santos-SP	Figueirense-SC	SP	SC	0	11/07	Vila Belmiro	18h30	8778	95.6		8393	3	0	Vinícius Gonçalves Dias Araujo-SP	N	191280	57977.72	2015	13	1	0	0	0	0	1	15	16	17	12	1
Luiz Flávio de Oliveira-SP	S	S	N	Emerson Augusto de Carvalho-SP_e_Daniel Paulo Ziolli-SP	Porto Alegre	Grêmio-RS	Vasco-RJ	RS	RJ	0	11/07	Arena do Grêmio	18h30	32464	100		32464	2	0	Francisco de Paula dos Santos Silva Neto-RS	N	1161582	961774.4	2015	13	1	0	0	0	0	1	4	19	5	19	1
Rodolpho Toski Marques-PR	N	N	N	Fabiano da Silva Ramires-ES_e_Sidmar dos Santos Meurer-PR	Campinas	Ponte Preta-SP	Atlético Mineiro-MG	SP	MG	0	11/07	Moisés Lucarelli	21h00	7431	59.8		4447	0	2	Flávio Rodrigues de Souza-SP	N	117530	47678.99	2015	13	0	0	1	1	0	0	11	1	9	1	1
Alisson Furtado-TO	N	S	N	Alessandro Álvaro Rocha Mattos-BA_e_Gilvan Cavalcante dos Santos Medrado-TO	São Paulo	São Paulo-SP	Coritiba-PR	SP	PR	0	12/07	Morumbi	11h00	59482	100		59482	3	1	Aurélio Santanna Martins-SP	N	1333055	1012711.23	2015	13	1	0	0	0	0	1	4	18	7	18	1
Leandro Pedro Vuaden-RS	S	N	N	Marcelo Bertanha Barison-RS_e_Rafael da Silva Alves-RS	Rio de Janeiro	Flamengo-RJ	Corinthians-SP	RJ	SP	0	12/07	Maracanã	16h00	30261	86.6		26209	0	3	Wagner do Nascimento Magalhães-RJ	N	1184210	321934.57	2015	13	0	0	1	1	0	0	17	2	14	5	1
Emerson Sobral-PE	N	N	N	Elan Vieira de Souza-PE_e_Albino Andrade Albert Júnior-PE	Belo Horizonte	Cruzeiro-MG	Goiás-GO	MG	GO	0	12/07	Mineirão	16h00	10675	100		10675	1	0	Cleisson Veloso Pereira-MG	N	362200.65	17924.82	2015	13	1	0	0	0	0	1	9	13	11	12	1
Anderson Daronco-RS	S	S	N	Cleriston Clay Barreto Rios-SE_e_José Javel Silveira-RS	Curitiba	Atlético Paranaense-PR	Fluminense-RJ	PR	RJ	0	12/07	Arena da Baixada	16h00	15648	100		15648	1	2	Rafael Traci-PR	N	317655	64324.59	2015	13	0	0	1	1	0	0	8	2	8	2	1
Francisco Carlos Nascimento-AL	N	S	N	Bruno Boschilla-PR_e_Pedro Jorge Santos de Araújo-AL	Joinville	Joinville-SC	Internacional-RS	SC	RS	0	12/07	Arena Joinville	16h00	10324	100		10324	0	2	Célio Amorim-SC	N	188270	113359.83	2015	13	0	0	1	1	0	0	20	12	20	15	1
Heber Roberto Lopes-SC	S	N	S	Carlos Berkenbrock-SC_e_Neuza Inês Back-SC	Florianópolis	Avaí-SC	Chapecoense-SC	SC	SC	1	12/07	Ressacada	18h30	5086	100		5086	2	1	Rodrigo D'Alonso Ferreira-SC	N	64104	29579.02	2015	13	1	0	0	0	0	1	14	9	15	9	1
Emerson de Almeida Ferreira-MG	N	N	S	Márcio Eustáquio Santiago-MG_e_Guilherme Dias Camilo-MG	São Lourenço da Mata	Sport-PE	Palmeiras-SP	PE	SP	0	12/07	Arena Pernambuco	18h30	32291	100		32291	2	2	Gilberto Rodrigues Castro Júnior-PE	N	1084320	784535.5	2015	13	0	1	0	0	1	0	4	4	3	3	1
Ricardo Marques Ribeiro-MG	S	N	S	Márcio Eustáquio Santiago-MG_e_Guilherme Dias Camilo-MG	Rio de Janeiro	Flamengo-RJ	Grêmio-RS	RJ	RS	0	18/07	Maracanã	18h30	45454	97.5		44318	1	0	Leonardo Garcia Cavaleiro-RJ	N	2070015	777700.38	2015	14	1	0	0	0	0	1	14	6	17	4	1
Marcelo de Lima Henrique-PE	N	N	N	Francisco Chaves-PE_e_Nailton Júnior de Sousa Oliveira-CE	Porto Alegre	Internacional-RS	Goiás-GO	RS	GO	0	18/07	Beira-Rio	18h30	16768	100		16768	2	1	Daniel Nobre Bins-RS	N	386065	210757.22	2015	14	1	0	0	0	0	1	12	13	12	13	1
Anderson Daronco-RS	S	S	N	Fabrício Vilarinho da Silva-GO_e_Bruno Pires-GO	São Paulo	Corinthians-SP	Atlético Mineiro-MG	SP	MG	0	18/07	Arena Corinthians	21h00	36280	100		36280	1	0	Aurélio Santanna Martins-SP	N	2376803.51	1598677.33	2015	14	1	0	0	0	0	1	2	1	2	1	1
Luiz César de Oliveira Magalhães-CE	N	S	N	Cleriston Clay Barreto Rios-SE_e_Rogério Pablos Zanardo-SP	Curitiba	Atlético Paranaense-PR	Chapecoense-SC	PR	SC	0	19/07	Arena da Baixada	11h00	15892	100		15892	1	0	Adriano Milczvski-PR	N	317330	61296.92	2015	14	1	0	0	0	0	1	8	10	8	9	1
Wagner do Nascimento Magalhães-RJ	N	S	N	Rodrigo F. Henrique Correa-RJ_e_Dibert Pedrosa Moisés-RJ	São Paulo	Palmeiras-SP	Santos-SP	SP	SP	1	19/07	Allianz Parque	16h00	38220	100		38220	1	0	Márcio Henrique de Gois-SP	N	2741640	1979391.19	2015	14	1	0	0	0	0	1	4	16	4	15	1
Luiz Flávio de Oliveira-SP	S	S	N	Marcelo Carvalho Van Gasse-SP_e_Danilo Ricardo Simon Manis-SP	Rio de Janeiro	Fluminense-RJ	Vasco-RJ	RJ	RJ	1	19/07	Maracanã	16h00	38618	97.6		37686	1	2	Alexandre Vargas Tavares de Jesus-RJ	N	1816345	639395.41	2015	14	0	0	1	1	0	0	5	19	2	19	1
Emerson Sobral-PE	N	N	N	Clóvis Amaral da Silva-PE_e_Fabiano da Silva Ramires-ES	Florianópolis	Figueirense-SC	Coritiba-PR	SC	PR	0	19/07	Orlando Scarpelli	16h00	8016	100		8016	0	0	Bráulio da Silva Machado-SC	N	124820	88871.41	2015	14	0	1	0	0	1	0	17	18	16	18	1
André Luiz de Freitas Castro-GO	N	S	N	Alessandro Álvaro Rocha Mattos-BA_e_Eduardo Gonçalves da Cruz-MS	São Lourenço da Mata	Sport-PE	São Paulo-SP	PE	SP	0	19/07	Arena Pernambuco	16h00	35835	100		35835	2	0	Nielson Nogueira Dias-PE	N	1254240	903993	2015	14	1	0	0	0	0	1	3	7	4	4	1
Jaílson Macedo Freitas-BA	N	N	N	Elicarlos Franco de Oliveira-BA_e_José Carlos Oliveira dos Santos-BA	Belo Horizonte	Cruzeiro-MG	Avaí-SC	MG	SC	0	19/07	Mineirão	18h30	13861	100		13860	1	1	Cleisson Veloso Pereira-MG	N	491690	48741.32	2015	14	0	1	0	0	1	0	9	14	9	14	1
Raphael Claus-SP	S	S	S	Kléber Lúcio Gil-SC_e_Nadine Schramm Camara Bastos-SC	Joinville	Joinville-SC	Ponte Preta-SP	SC	SP	0	19/07	Arena Joinville	18h30	8250	100		8250	1	1	Ronan Marques da Rosa-SC	N	98560	38478.66	2015	14	0	1	0	0	1	0	20	11	20	11	1
Wilton Pereira Sampaio-GO	S	S	N	Fabrício Vilarinho da Silva-GO_e_Eduardo Gonçalves da Cruz-MS	Florianópolis	Avaí-SC	Atlético Paranaense-PR	SC	PR	0	25/07	Ressacada	18h30	6197	100		6197	1	2	Evandro Bender-SC	N	98990	58993.49	2015	15	0	0	1	1	0	0	16	8	14	8	1
Péricles Bassols Pegado Cortez-RJ	S	S	N	Rodrigo F. Henrique Correa-RJ_e_Dibert Pedrosa Moisés-RJ	Porto Alegre	Grêmio-RS	Sport-PE	RS	PE	0	25/07	Arena do Grêmio	19h30	31084	100		31084	1	1	Luís Teixeira Rocha-RS	N	1134524	936477.68	2015	15	0	1	0	0	1	0	5	5	6	3	1
Luiz Flávio de Oliveira-SP	S	S	N	Marcelo Carvalho Van Gasse-SP_e_Rogério Pablos Zanardo-SP	Belo Horizonte	Atlético Mineiro-MG	Figueirense-SC	MG	SC	0	25/07	Independência	21h00	18068	88.9		16056	1	0	Igor Junio Benevenuto-MG	N	644340	88177.19	2015	15	1	0	0	0	0	1	1	17	1	17	1
Ricardo Marques Ribeiro-MG	S	N	N	Márcio Eustáquio Santiago-MG_e_Marcus Vinicius Gomes-MG	Santos	Santos-SP	Joinville-SC	SP	SC	0	26/07	Vila Belmiro	11h00	13699	94.7		12974	2	0	Adriano de Assis Miranda-SP	N	335725	180614.02	2015	15	1	0	0	0	0	1	14	20	16	20	1
Raphael Claus-SP	S	N	N	Danilo Ricardo Simon Manis-SP_e_Daniel Paulo Ziolli-SP	Chapecó	Chapecoense-SC	Fluminense-RJ	SC	RJ	0	26/07	Arena Condá	11h00	8494	100		8494	2	1	Carlos Eduardo Vieira Areas-SC	N	112200	68271.6	2015	15	1	0	0	0	0	1	9	7	10	5	1
Marcelo de Lima Henrique-PE	N	N	N	Clóvis Amaral da Silva-PE_e_Albino Andrade Albert Júnior-PE	São Paulo	São Paulo-SP	Cruzeiro-MG	SP	MG	0	26/07	Morumbi	16h00	33905	87.4		29648	1	0	Flávio Rodrigues de Souza-SP	N	740897	488687.15	2015	15	1	0	0	0	0	1	4	10	7	9	1
Bruno Arleu de Araújo-RJ	N	N	N	Luiz Cláudio Regazone-RJ_e_João Luiz Coelho de Albuquerque-RJ	Campinas	Ponte Preta-SP	Internacional-RS	SP	RS	0	26/07	Moisés Lucarelli	16h00	7263	58.7		4263	0	0	Marcelo Aparecido Ribeiro de Souza-SP	N	80090	17617.09	2015	15	0	1	0	0	1	0	11	11	11	12	1
Pablo dos Santos Alves-PB	N	S	S	Alessandro Álvaro Rocha Mattos-BA_e_Cleriston Clay Barreto Rios-SE	Curitiba	Coritiba-PR	Corinthians-SP	PR	SP	0	26/07	Couto Pereira	16h00	17225	100		17225	1	1	Rodolpho Toski Marques-PR	N	611390	295651.68	2015	15	0	1	0	0	1	0	18	3	18	2	1
Heber Roberto Lopes-SC	S	S	N	Kléber Lúcio Gil-SC_e_Carlos Berkenbrock-SC	Goiânia	Goiás-GO	Flamengo-RJ	GO	RJ	0	26/07	Serra Dourada	16h00	10398	98.5		10245	0	1	Eduardo Tomaz de Aquino Valadão-GO	N	764780	588065.99	2015	15	0	0	1	1	0	0	15	13	13	14	1
Anderson Daronco-RS	S	S	N	Fábio Pereira-TO_e_Rafael da Silva Alves-RS	Rio de Janeiro	Vasco-RJ	Palmeiras-SP	RJ	SP	0	26/07	São Januário	18h30	14001	98.4		13775	1	4	Leonardo Garcia Cavaleiro-RJ	N	348740	153673.94	2015	15	0	0	1	1	0	0	19	2	19	4	1
Leandro Pedro Vuaden-RS	S	S	N	Guilherme Dias Camilo-MG_e_Marcelo Bertanha Barison-RS	São Paulo	Corinthians-SP	Vasco-RJ	SP	RJ	0	29/07	Arena Corinthians	22h00	30340	100		30340	3	0	Leandro Bizzio Marinho-SP	N	1608159.76	966575.64	2015	16	1	0	0	0	0	1	2	19	3	19	0
Dewson Fernando Freitas da Silva-PA	S	S	N	Bruno Boschilla-PR_e_Márcio Gleidson Correia Dias-PA	Belo Horizonte	Atlético Mineiro-MG	São Paulo-SP	MG	SP	0	29/07	Mineirão	22h00	48477	93.6		45392	3	1	Cleisson Veloso Pereira-MG	N	1798010	428883.95	2015	16	1	0	0	0	0	1	1	6	1	4	0
Wilton Pereira Sampaio-GO	S	S	N	Bruno Boschilla-PR_e_Carlos Berkenbrock-SC	Rio de Janeiro	Fluminense-RJ	Grêmio-RS	RJ	RS	0	01/08	Maracanã	18h30	31436	88.6		27842	1	0	Wagner do Nascimento Magalhães-RJ	N	1257250	445916.25	2015	16	1	0	0	0	0	1	4	8	7	5	1
Ricardo Marques Ribeiro-MG	S	S	S	Guilherme Dias Camilo-MG_e_Cleriston Clay Barreto Rios-SE	São Paulo	Palmeiras-SP	Atlético Paranaense-PR	SP	PR	0	02/08	Allianz Parque	11h00	38794	100		38794	0	1	Jaílson Macedo Freitas-BA	N	3325090	2538326.86	2015	16	0	0	1	1	0	0	3	7	2	8	1
Dewson Fernando Freitas da Silva-PA	S	S	N	Fábio Pereira-TO_e_Márcio Eustáquio Santiago-MG	Curitiba	Coritiba-PR	Goiás-GO	PR	GO	0	02/08	Couto Pereira	11h00	24593	100		24593	1	1	Raphael Claus-SP	S	503750	223048.84	2015	16	0	1	0	0	1	0	19	16	18	15	1
Anderson Daronco-RS	S	S	S	Emerson Augusto de Carvalho-SP_e_Rodrigo F. Henrique Correa-RJ	Rio de Janeiro	Flamengo-RJ	Santos-SP	RJ	SP	0	02/08	Maracanã	16h00	52966	97.7		51749	2	2	Rodrigo Carvalhães de Miranda-RJ	N	2450700	986249.07	2015	16	0	1	0	0	1	0	12	14	13	14	1
Péricles Bassols Pegado Cortez-RJ	S	S	N	Alessandro Álvaro Rocha Mattos-BA_e_Rogério Pablos Zanardo-SP	Porto Alegre	Internacional-RS	Chapecoense-SC	RS	SC	0	02/08	Beira-Rio	16h00	17579	100		17579	0	0	Jean Pierre Gonçalves Lima-RS	N	433570	272554.71	2015	16	0	1	0	0	1	0	10	9	11	9	1
Heber Roberto Lopes-SC	S	N	N	Bruno Pires-GO_e_Bruno Chaves-PE	Florianópolis	Figueirense-SC	Ponte Preta-SP	SC	SP	0	02/08	Orlando Scarpelli	16h00	7245	100		7245	3	1	Igor Junio Benevenuto-MG	N	105530	71520.3	2015	16	1	0	0	0	0	1	15	12	17	11	1
Rodrigo D'Alonso Ferreira-SC	N	N	N	Danilo Ricardo Simon Manis-SP_e_Helton Nunes-SC	Joinville	Joinville-SC	Avaí-SC	SC	SC	1	02/08	Arena Joinville	16h00	11245	100		11245	2	0	Bráulio da Silva Machado-SC	N	156985	88879.24	2015	16	1	0	0	0	0	1	18	17	20	16	1
Leandro Pedro Vuaden-RS	S	S	S	Marcelo Carvalho Van Gasse-SP_e_Fabrício Vilarinho da Silva-GO	São Lourenço da Mata	Sport-PE	Cruzeiro-MG	PE	MG	0	02/08	Arena Pernambuco	18h30	24456	100		24456	0	0	Luiz Flávio de Oliveira-SP	S	751130	530205.6	2015	16	0	1	0	0	1	0	5	11	5	10	1
Thiago Duarte Peixoto-SP	N	N	N	Márcio Eustáquio Santiago-MG_e_Rogério Pablos Zanardo-SP	Florianópolis	Avaí-SC	Fluminense-RJ	SC	RJ	0	08/08	Ressacada	18h30	10766	100		10766	1	0	Bráulio da Silva Machado-SC	N	288720	228034.24	2015	17	1	0	0	0	0	1	16	6	17	4	1
Igor Junio Benevenuto-MG	N	S	N	Kléber Lúcio Gil-SC_e_Carlos Berkenbrock-SC	Santos	Santos-SP	Coritiba-PR	SP	PR	0	08/08	Vila Belmiro	21h00	12793	98.9		12657	3	0	Marcelo Prieto Alfieri-SP	N	306585	145950.76	2015	17	1	0	0	0	0	1	12	20	14	19	1
Luiz Flávio de Oliveira-SP	S	S	N	Fábio Pereira-TO_e_Bruno Chaves-PE	Rio de Janeiro	Vasco-RJ	Joinville-SC	RJ	SC	0	09/08	Maracanã	11h00	37217	95.4		35508	0	0	Rodrigo Carvalhães de Miranda-RJ	N	1432035	475221.1	2015	17	0	1	0	0	1	0	19	18	19	18	1
Anderson Daronco-RS	S	N	N	Danilo Ricardo Simon Manis-SP_e_Luiz Cláudio Regazone-RJ	Curitiba	Atlético Paranaense-PR	Sport-PE	PR	PE	0	09/08	Arena da Baixada	11h00	24826	100		24826	1	1	Fábio Filipus-PR	N	744755	398274.3	2015	17	0	1	0	0	1	0	7	4	7	5	1
Leandro Pedro Vuaden-RS	S	S	N	Guilherme Dias Camilo-MG_e_Alex Ang Ribeiro-SP	São Paulo	São Paulo-SP	Corinthians-SP	SP	SP	1	09/08	Morumbi	16h00	37984	82.4		31284	1	1	Wagner do Nascimento Magalhães-RJ	N	891724	574632.39	2015	17	0	1	0	0	1	0	7	2	6	2	1
Jaílson Macedo Freitas-BA	N	S	S	Alessandro Álvaro Rocha Mattos-BA_e_Cleriston Clay Barreto Rios-SE	Campinas	Ponte Preta-SP	Flamengo-RJ	SP	RJ	0	09/08	Moisés Lucarelli	16h00	16190	66.2		10716	1	0	Flávio Rodrigues de Souza-SP	N	353830	312125.54	2015	17	1	0	0	0	0	1	11	13	12	12	1
Wilton Pereira Sampaio-GO	S	S	N	Fabrício Vilarinho da Silva-GO_e_Bruno Pires-GO	Belo Horizonte	Cruzeiro-MG	Palmeiras-SP	MG	SP	0	09/08	Mineirão	16h00	20844	100		20839	2	1	Igor Junio Benevenuto-MG	N	781710	113647.41	2015	17	1	0	0	0	0	1	9	4	11	3	1
Raphael Claus-SP	S	S	S	Bruno Boschilla-PR_e_Rodrigo F. Henrique Correa-RJ	Goiânia	Goiás-GO	Atlético Mineiro-MG	GO	MG	0	09/08	Serra Dourada	16h00	7033	99.9		7026	0	0	Elmo Alves Resende Cunha-GO	N	244170	172079.82	2015	17	0	1	0	0	1	0	16	1	16	1	1
Dewson Fernando Freitas da Silva-PA	S	S	S	Emerson Augusto de Carvalho-SP_e_Marcelo Carvalho Van Gasse-SP	Porto Alegre	Grêmio-RS	Internacional-RS	RS	RS	1	09/08	Arena do Grêmio	18h30	42432	100		42432	5	0	Marcelo de Lima Henrique-PE	N	1745584	1466765.79	2015	17	1	0	0	0	0	1	3	15	8	10	1
Ricardo Marques Ribeiro-MG	S	N	N	Rosnei Hoffmann Scherer-SC_e_Helton Nunes-SC	Chapecó	Chapecoense-SC	Figueirense-SC	SC	SC	1	09/08	Arena Condá	18h30	8728	100		8728	2	2	Edivaldo Elias da Silva-PR	N	98590	59082.9	2015	17	0	1	0	0	1	0	10	14	9	15	1
Marcelo Aparecido Ribeiro de Souza-SP	N	N	N	Danilo Ricardo Simon Manis-SP_e_Rogério Pablos Zanardo-SP	Rio de Janeiro	Flamengo-RJ	Atlético Paranaense-PR	RJ	PR	0	12/08	Maracanã	19h30	20399	88.1		17962	3	2	João Ennio Sobral-RJ	N	595975	92505.63	2015	18	1	0	0	0	0	1	12	8	13	7	0
Péricles Bassols Pegado Cortez-RJ	S	N	N	Dibert Pedrosa Moisés-RJ_e_Luiz Cláudio Regazone-RJ	Curitiba	Coritiba-PR	Palmeiras-SP	PR	SP	0	12/08	Couto Pereira	19h30	13373	100		13373	2	1	Fábio Filipus-PR	N	451580	179598.6	2015	18	1	0	0	0	0	1	19	4	20	4	0
Emerson Sobral-PE	N	S	N	Guilherme Dias Camilo-MG_e_Fabiano da Silva Ramires-ES	Santos	Santos-SP	Vasco-RJ	SP	RJ	0	12/08	Vila Belmiro	21h00	12502	96.3		12038	1	0	Aurélio Santanna Martins-SP	N	281255	124690.41	2015	18	1	0	0	0	0	1	11	20	12	19	0
Wagner do Nascimento Magalhães-RJ	N	N	N	Eduardo de Souza Couto-RJ_e_Thiago Henrique Neto Corrêa Farinha-RJ	Goiânia	Goiás-GO	Chapecoense-SC	GO	SC	0	12/08	Serra Dourada	21h00	1170	100		1170	0	0	Osimar Moreira-GO	N	24185	781.15	2015	18	0	1	0	0	1	0	16	9	16	10	0
Luiz Flávio de Oliveira-SP	S	N	N	Alex Ang Ribeiro-SP_e_Miguel Cataneo Ribeiro da Costa-SP	São Paulo	Corinthians-SP	Sport-PE	SP	PE	0	12/08	Arena Corinthians	22h00	30941	100		30941	4	3	Marcelo Prieto Alfieri-SP	N	1671129.76	979253.76	2015	18	1	0	0	0	0	1	1	6	2	4	0
Flávio Rodrigues Guerra-SP	N	N	N	Vicente Romano Neto-SP_e_Carlos Augusto Nogueira Júnior-SP	Porto Alegre	Internacional-RS	Fluminense-RJ	RS	RJ	0	12/08	Beira-Rio	22h00	9222	100		9222	1	0	Daniel Nobre Bins-RS	N	208025	63785.93	2015	18	1	0	0	0	0	1	14	6	15	6	0
Anderson Daronco-RS	S	N	N	Marcelo Bertanha Barison-RS_e_José Javel Silveira-RS	Florianópolis	Figueirense-SC	São Paulo-SP	SC	SP	0	12/08	Orlando Scarpelli	22h00	9922	100		9922	0	2	Edson da Silva-SC	N	230980	180661.63	2015	18	0	0	1	1	0	0	15	4	14	7	0
Marcelo de Lima Henrique-PE	N	N	N	Elan Vieira de Souza-PE_e_Bruno Chaves-PE	Campinas	Ponte Preta-SP	Avaí-SC	SP	SC	0	13/08	Moisés Lucarelli	19h30	8537	81.4		6953	2	0	José Cláudio Rocha Filho-SP	N	82210	17093.55	2015	18	1	0	0	0	0	1	9	18	11	16	0
Dewson Fernando Freitas da Silva-PA	S	S	N	Bruno Boschilla-PR_e_Bruno Pires-GO	Belo Horizonte	Atlético Mineiro-MG	Grêmio-RS	MG	RS	0	13/08	Mineirão	21h00	49184	95.5		46966	0	2	Renato Cardoso Conceição-MG	N	1395250	231095.95	2015	18	0	0	1	1	0	0	1	3	1	3	0
Leandro Pedro Vuaden-RS	S	N	N	Ivan Carlos Bohn-PR_e_Lúcio Beiersdorf Flor-RS	Joinville	Joinville-SC	Cruzeiro-MG	SC	MG	0	13/08	Arena Joinville	21h00	10496	100		10496	3	0	Willian Machado Steffens-SC	N	158095	180661.63	2015	18	1	0	0	0	0	1	17	13	18	9	0
Raphael Claus-SP	S	S	S	Emerson Augusto de Carvalho-SP_e_Marcelo Carvalho Van Gasse-SP	Rio de Janeiro	Vasco-RJ	Coritiba-PR	RJ	PR	0	15/08	Maracanã	18h30	10856	77.1		8373	0	1	Alexandre Vargas Tavares de Jesus-RJ	N	297030	8918.76	2015	19	0	0	1	1	0	0	20	19	20	19	1
Bruno Arleu de Araújo-RJ	N	S	N	Guilherme Dias Camilo-MG_e_Cristhian Passos Sorence-GO	Curitiba	Atlético Paranaense-PR	Santos-SP	PR	SP	0	15/08	Arena da Baixada	18h30	19849	100		19849	0	0	Edivaldo Elias da Silva-PR	N	534530	232185.74	2015	19	0	1	0	0	1	0	8	11	8	11	1
Marielson Alves Silva-BA	N	S	N	Alessandro Álvaro Rocha Mattos-BA_e_Pablo Almeida Costa-MG	São Paulo	São Paulo-SP	Goiás-GO	SP	GO	0	15/08	Morumbi	21h00	30758	82.6		25406	0	3	Márcio Henrique de Gois-SP	N	635059	410273.05	2015	19	0	0	1	1	0	0	6	14	4	16	1
Igor Junio Benevenuto-MG	N	S	S	Fábio Pereira-TO_e_Bruno Boschilla-PR	São Paulo	Palmeiras-SP	Flamengo-RJ	SP	RJ	0	16/08	Allianz Parque	11h00	37739	100		37739	4	2	Márcio Henrique de Gois-SP	N	2908585	2161044.75	2015	19	1	0	0	0	0	1	4	12	4	12	1
Diego Almeida Real-RS	N	N	N	Fabiano da Silva Ramires-ES_e_José Eduardo Calza-RS	Rio de Janeiro	Fluminense-RJ	Figueirense-SC	RJ	SC	0	16/08	Maracanã	16h00	21384	90.9		19444	2	1	Leonardo Garcia Cavaleiro-RJ	N	643170	170773.35	2015	19	1	0	0	0	0	1	5	16	6	15	1
Luiz Flávio de Oliveira-SP	S	S	N	Kléber Lúcio Gil-SC_e_Daniel Paulo Ziolli-SP	Belo Horizonte	Cruzeiro-MG	Internacional-RS	MG	RS	0	16/08	Mineirão	16h00	14166	100		14166	0	0	Renato Cardoso Conceição-MG	N	449105	-30380.46	2015	19	0	1	0	0	1	0	14	12	13	14	1
Anderson Daronco-RS	S	N	S	Márcio Eustáquio Santiago-MG_e_Nadine Schramm Camara Bastos-SC	Florianópolis	Avaí-SC	Corinthians-SP	SC	SP	0	16/08	Ressacada	16h00	11304	100		11304	1	2	Rodrigo D'Alonso Ferreira-SC	N	312902	247601.52	2015	19	0	0	1	1	0	0	17	2	18	1	1
Sandro Meira Ricci-SC	S	N	N	Clóvis Amaral da Silva-PE_e_Francisco Chaves-PE	Recife	Sport-PE	Ponte Preta-SP	PE	SP	0	16/08	Ilha do Retiro	16h00	16084	88.9		14296	1	1	Nielson Nogueira Dias-PE	N	398030	264420.5	2015	19	0	1	0	0	1	0	7	10	6	9	1
Jaílson Macedo Freitas-BA	N	N	N	Luiz Cláudio Regazone-RJ_e_Marcos W. Rocha de Amorim-BA	Porto Alegre	Grêmio-RS	Joinville-SC	RS	SC	0	16/08	Arena do Grêmio	18h30	31183	100		31183	2	1	Jean Pierre Gonçalves Lima-RS	N	1069768	882944.27	2015	19	1	0	0	0	0	1	3	18	3	17	1
Marcos André Gomes-ES	N	S	N	Fabrício Vilarinho da Silva-GO_e_Danilo Ricardo Simon Manis-SP	Chapecó	Chapecoense-SC	Atlético Mineiro-MG	SC	MG	0	16/08	Arena Condá	18h30	8133	100		8133	2	1	Eduardo Cordeiro Guimarães-SC	N	104780	62148.86	2015	19	1	0	0	0	0	1	9	1	9	1	1
Leandro Pedro Vuaden-RS	S	S	N	Alessandro Álvaro Rocha Mattos-BA_e_Marcelo Bertanha Barison-RS	Santos	Santos-SP	Avaí-SC	SP	SC	0	22/08	Vila Belmiro	18h30	12279	98		12036	5	2	Adriano de Assis Miranda-SP	N	289880	135230.21	2015	20	1	0	0	0	0	1	8	19	11	17	1
Luiz Flávio de Oliveira-SP	S	N	N	Alex Ang Ribeiro-SP_e_Miguel Cataneo Ribeiro da Costa-SP	Goiânia	Goiás-GO	Vasco-RJ	GO	RJ	0	22/08	Serra Dourada	18h30	11183	99.9		11177	3	0	Bruno Rezende-GO	N	267895	186314.38	2015	20	1	0	0	0	0	1	11	20	14	20	1
Wagner do Nascimento Magalhães-RJ	N	N	N	Dibert Pedrosa Moisés-RJ_e_Thiago Henrique Neto Corrêa Farinha-RJ	Florianópolis	Figueirense-SC	Sport-PE	SC	PE	0	22/08	Orlando Scarpelli	21h00	4879	100		4879	2	1	Carlos Eduardo Vieira Areas-SC	N	62130	27784.96	2015	20	1	0	0	0	0	1	16	7	16	7	1
Emerson de Almeida Ferreira-MG	N	S	N	Bruno Boschilla-PR_e_Sidmar dos Santos Meurer-MG	Campinas	Ponte Preta-SP	Grêmio-RS	SP	RS	0	23/08	Moisés Lucarelli	11h00	10957	69.9		7658	0	0	Márcio Henrique de Gois-SP	N	145830	63845.39	2015	20	0	1	0	0	1	0	11	3	10	3	1
Ricardo Marques Ribeiro-MG	S	N	N	Marcus Vinicius Gomes-MG_e_Marconi Helbert Vieira-MG	Curitiba	Coritiba-PR	Chapecoense-SC	PR	SC	0	23/08	Couto Pereira	11h00	21114	100		21114	1	0	Adriano Milczvski-PR	N	397145	122625.99	2015	20	1	0	0	0	0	1	17	10	19	9	1
Péricles Bassols Pegado Cortez-RJ	S	S	N	Rodrigo F. Henrique Correa-RJ_e_Luiz Cláudio Regazone-RJ	São Paulo	Corinthians-SP	Cruzeiro-MG	SP	MG	0	23/08	Arena Corinthians	16h00	41014	100		41014	3	0	Thiago Duarte Peixoto-SP	N	2671941.5	1730485.42	2015	20	1	0	0	0	0	1	1	15	2	14	1
Anderson Daronco-RS	S	S	S	Fabrício Vilarinho da Silva-GO_e_Fábio Pereira-TO	Rio de Janeiro	Flamengo-RJ	São Paulo-SP	RJ	SP	0	23/08	Maracanã	16h00	38146	97		36991	2	1	Antônio Frederico de Carvalho Schneider-RJ	N	1163960	276138.74	2015	20	1	0	0	0	0	1	14	6	12	6	1
Raphael Claus-SP	S	S	S	Emerson Augusto de Carvalho-SP_e_Marcelo Carvalho Van Gasse-SP	Porto Alegre	Internacional-RS	Atlético Paranaense-PR	RS	PR	0	23/08	Beira-Rio	16h00	19241	100		19241	2	0	Jean Pierre Gonçalves Lima-RS	N	463150	284314.99	2015	20	1	0	0	0	0	1	11	8	12	8	1
Emerson Sobral-PE	N	S	N	Guilherme Dias Camilo-MG_e_Clóvis Amaral da Silva-PE	Joinville	Joinville-SC	Fluminense-RJ	SC	RJ	0	23/08	Arena Joinville	16h00	12395	100		12395	2	1	Evandro Bender-SC	N	293040	201859.76	2015	20	1	0	0	0	0	1	17	5	18	5	1
Sandro Meira Ricci-SC	S	N	N	Carlos Berkenbrock-SC_e_Eduardo Gonçalves da Cruz-MS	Belo Horizonte	Atlético Mineiro-MG	Palmeiras-SP	MG	SP	0	23/08	Independência	18h30	19865	87.9		17464	2	1	Vinícius Gonçalves Dias Araujo-SP	N	683385	32184.8	2015	20	1	0	0	0	0	1	2	4	1	4	1
Francisco Carlos Nascimento-AL	N	N	N	Pedro Jorge Santos de Araújo-AL_e_Esdras Mariano de Lima-AL	Rio de Janeiro	Vasco-RJ	Figueirense-SC	RJ	SC	0	29/08	Maracanã	18h30	16224	91.6		14857	0	1	João Ennio Sobral-RJ	N	436840	22259.67	2015	21	0	0	1	1	0	0	20	13	20	16	1
