arbitro_principal	arbitro_principal_quadro_fifa	aux1_quadro_fifa	aux2_quadro_fifa	auxiliares	cidade	clubem	clubev	estado_m	estado_v	clássico	data	estadio	hora	ingressos_disponiveis	porcentagem_ingresso_vendido	observacoes	Publico_pagante	placar_mandante	placar_visitante	quarto_arbitro	quarto_arbitro_quadro_fifa	renda_bruta	renda_liq	ano	rodada	vitoria_mandante	empate_mandante	derrota_mandante	vitoria_visitante	empate_vvisitante	derrota_visitante	mandante_posicao_final_rodada	Visitante_posicao_final_rodada	mandante_posicao_inicio_rodada	Visitante_posicao_inicio_rodada	final de semana
Marcelo Aparecido Ribeiro de Souza-SP	N	S	N	Marcelo Carvalho Van Gasse-SP_e_Rogério Pablos Zanardo-SP	Belo Horizonte	Cruzeiro-MG	Atlético Paranaense-PR	MG	PR	0	17/09	Mineirão	19h30	17850	100		17850	2	0	Cleisson Veloso Pereira-MG	N	631678	21546.46	2014	22	1	0	0	0	0	1	1	9	1	9	0
Thiago Duarte Peixoto-SP	N	N	N	Márcio Luiz Augusto-SP_e_Carlos Augusto Nogueira Júnior-SP	Salvador	Vitória-BA	Fluminense-RJ	BA	RJ	0	17/09	Manoel Barradas (Barradão)	19h30	7589	84.8		6438	3	1	Lúcio José Silva de Araújo-BA	N	43934	-12954.31	2014	22	1	0	0	0	0	1	19	3	19	3	0
Felipe Gomes da Silva-PR	N	S	N	Bruno Boschilla-PR_e_Luiz H. Souza Santos Renesto-PR	São Lourenço da Mata	Sport-PE	Internacional-RS	PE	RS	0	17/09	Arena Pernambuco	21h00	25826	56.5		14581	0	0	Emerson Sobral-PE	N	403050	304897.39	2014	22	0	1	0	0	1	0	10	4	10	4	0
Paulo Henrique Godoy Bezerra-SC	N	S	S	Nadine Schramm Camara Bastos-SC_e_Neuza Inês Back-SC	Florianópolis	Figueirense-SC	Criciúma-SC	SC	SC	1	17/09	Orlando Scarpelli	21h00	7440	100		7440	1	1	Bráulio da Silva Machado-SC	N	102185	67879.72	2014	22	0	1	0	0	1	0	16	20	16	19	0
Igor Junio Benevenuto-MG	N	S	N	Márcio Eustáquio Santiago-MG_e_Guilherme Dias Camilo-MG	Rio de Janeiro	Botafogo-RJ	Bahia-BA	RJ	BA	0	17/09	Maracanã	22h00	9517	49.2		4678	2	3	Raphael Silvano F. da Silva-RJ	N	106275	-46643.41	2014	22	0	0	1	1	0	0	14	15	12	15	0
Anderson Daronco-RS	N	N	N	José Javel Silveira-RS_e_José Eduardo Calza-RS	São Paulo	Palmeiras-SP	Flamengo-RJ	SP	RJ	0	17/09	Pacaembu	22h00	19684	98.3		19350	2	2	Aurélio Santanna Martins-SP	N	464752.5	154612.77	2014	22	0	1	0	0	1	0	18	11	18	11	0
Dewson Fernando Freitas da Silva-PA	N	N	N	Márcio Gleidson Correia Dias-PA_e_Thiago Gomes Brigido-MG	Curitiba	Coritiba-PR	São Paulo-SP	PR	SP	0	17/09	Couto Pereira	22h00	16201	100		16201	3	1	Leonardo Sígari Zanon-PR	N	543010.5	291088.43	2014	22	1	0	0	0	0	1	12	2	14	2	0
Felipe Varejão-ES	N	N	N	Luiz Cláudio Regazone-RJ_e_Gilberto Stina Pereira-RJ	São Paulo	Corinthians-SP	Chapecoense-SC	SP	SC	0	18/09	Arena Corinthians	19h30	25537	100		25537	1	1	Vinícius Furlan-SP	N	1359473	682427.24	2014	22	0	1	0	0	1	0	5	16	5	16	0
Luiz Flávio de Oliveira-SP	N	S	N	Emerson Augusto de Carvalho-SP_e_Vicente Romano Neto-SP	Goiânia	Goiás-GO	Atlético Mineiro-MG	GO	MG	0	18/09	Serra Dourada	19h30	3441	100		3441	2	3	Fabrício Nery Trindade-GO	N	81450	36480.36	2014	22	0	0	1	1	0	0	12	7	12	7	0
Ricardo Marques Ribeiro-MG	S	N	N	Celso Luiz da Silva-MG_e_Marcus Vinicius Gomes-MG	Porto Alegre	Grêmio-RS	Santos-SP	RS	SP	0	18/09	Arena do Grêmio	20h30	18904	100		18904	0	0	Daniel Nobre Bins-RS	N	481563	371003.62	2014	22	0	1	0	0	1	0	6	8	6	7	0
Flávio Rodrigues de Souza-SP	N	S	N	Emerson Augusto de Carvalho-SP_e_Márcio Luiz Augusto-SP	Curitiba	Atlético Paranaense-PR	Internacional-RS	PR	RS	0	20/09	Arena da Baixada	18h30	17305	100		17305	0	1	Adriano Milczvski-PR	N	370880	91932.53	2014	23	0	0	1	1	0	0	11	3	9	4	1
Wilton Pereira Sampaio-GO	S	N	N	João Patrício de Araújo-GO_e_Bruno Pires-GO	Criciúma	Criciúma-SC	Botafogo-RJ	SC	RJ	0	20/09	Heriberto Hulse	21h00	8548	100		8548	1	1	Célio Amorim-SC	N	118785	79357.08	2014	23	0	1	0	0	1	0	19	13	20	14	1
Dewson Fernando Freitas da Silva-PA	N	N	N	Marcelo Bertanha Barison-RS_e_José Antônio Chaves Franco Filho-RS	Rio de Janeiro	Flamengo-RJ	Fluminense-RJ	RJ	RJ	1	21/09	Maracanã	16h00	46554	81.4		37918	1	1	Estevão Cunha da Trindade-RJ	N	1588090	512728.42	2014	23	0	1	0	0	1	0	12	5	11	3	1
Leandro Pedro Vuaden-RS	S	N	N	José Javel Silveira-RS_e_José Eduardo Calza-RS	Recife	Sport-PE	Coritiba-PR	PE	PR	0	21/09	Ilha do Retiro	16h00	14065	93.7		13180	1	0	Luiz Sobral-PE	N	256540	180399.54	2014	23	1	0	0	0	0	1	10	14	10	12	1
Luiz Flávio de Oliveira-SP	N	S	N	Marcelo Carvalho Van Gasse-SP_e_Rogério Pablos Zanardo-SP	São Paulo	Corinthians-SP	São Paulo-SP	SP	SP	1	21/09	Arena Corinthians	16h00	34688	100		34688	3	2	José Cláudio Rocha Filho-SP	N	2405986.5	1410928.45	2014	23	1	0	0	0	0	1	3	2	5	2	1
Marcelo de Lima Henrique-RJ	S	S	N	Rodrigo Pereira Joia-RJ_e_Rodrigo F. Henrique Correa-RJ	Belo Horizonte	Cruzeiro-MG	Atlético Mineiro-MG	MG	MG	1	21/09	Mineirão	16h00	52073	95.1		49534	2	3	Cleisson Veloso Pereira-MG	N	3036936	-114562.06	2014	23	0	0	1	1	0	0	1	7	1	7	1
Ricardo Marques Ribeiro-MG	S	S	S	Fábio Pereira-TO_e_Cleriston Clay Barreto Rios-SE	Salvador	Vitória-BA	Bahia-BA	BA	BA	1	21/09	Arena Fonte Nova	16h00	25192	100		25192	2	1	Lúcio José Silva de Araújo-BA	N	881444.5	487543.08	2014	23	1	0	0	0	0	1	16	15	19	15	1
Elmo Alves Resende Cunha-GO	N	N	N	Jesmar Benedito Miranda de Paula-GO_e_Leone Carvalho-GO	Santos	Santos-SP	Figueirense-SC	SP	SC	0	21/09	Vila Belmiro	18h30	7128	78.2		5571	3	1	Raphael Claus-SP	N	96310	-7067.63	2014	23	1	0	0	0	0	1	8	17	8	16	1
André Luiz de Freitas Castro-GO	N	S	N	Fabrício Vilarinho da Silva-GO_e_Cristhian Passos Sorence-GO	Porto Alegre	Grêmio-RS	Chapecoense-SC	RS	SC	0	21/09	Arena do Grêmio	18h30	16760	100		16760	1	0	Daniel Nobre Bins-RS	N	440207	335063.7	2014	23	1	0	0	0	0	1	6	18	6	16	1
Igor Junio Benevenuto-MG	N	S	N	Márcio Eustáquio Santiago-MG_e_Guilherme Dias Camilo-MG	Goiânia	Goiás-GO	Palmeiras-SP	GO	SP	0	21/09	Serra Dourada	18h30	7845	100		7845	6	0	Breno Souza-GO	N	169365	100629.8	2014	23	1	0	0	0	0	1	9	20	12	18	1
Vinícius Furlan-SP	N	N	N	Rogério Pablos Zanardo-SP_e_Vicente Romano Neto-SP	Curitiba	Coritiba-PR	Cruzeiro-MG	PR	MG	0	24/09	Couto Pereira	19h30	9521	100		9521	1	2	Felipe Varejão-ES	N	171099	33677.12	2014	24	0	0	1	1	0	0	16	1	14	1	0
Marcelo de Lima Henrique-RJ	S	N	N	Rodrigo F. Henrique Correa-RJ_e_Gilberto Stina Pereira-RJ	Porto Alegre	Internacional-RS	Criciúma-SC	RS	SC	0	24/09	Beira-Rio	19h30	15701	100		15701	3	0	Estevão Cunha da Trindade-RJ	N	396620	227596.57	2014	24	1	0	0	0	0	1	2	20	3	19	0
Flávio Rodrigues Guerra-SP	N	S	N	Marcelo Carvalho Van Gasse-SP_e_Danilo Ricardo Simon Manis-SP	Salvador	Bahia-BA	Sport-PE	BA	PE	0	24/09	Arena Fonte Nova	21h00	13360	100		13360	1	0	Valdicleson Silva da Costa-AP	N	254815	22817.29	2014	24	1	0	0	0	0	1	14	10	15	10	0
Charles Hebert Cavalcante Ferreira-AL	N	N	N	Pedro Jorge Santos de Araújo-AL_e_Esdras Mariano de Lima-AL	Chapecó	Chapecoense-SC	Atlético Paranaense-PR	SC	PR	0	24/09	Arena Condá	21h00	6610	100		6610	3	0	Paulo Henrique de Melo Salmazio-MS	N	76890	38733.73	2014	24	1	0	0	0	0	1	14	13	18	11	0
Heber Roberto Lopes-SC	S	S	S	Kléber Lúcio Gil-SC_e_Emerson Augusto de Carvalho-SP	Rio de Janeiro	Fluminense-RJ	Grêmio-RS	RJ	RS	0	24/09	Maracanã	22h00	13223	47		6211	0	0	Jaílson Macedo Freitas-BA	N	166365	-8538.36	2014	24	0	1	0	0	1	0	4	7	5	6	0
André Luiz de Freitas Castro-GO	N	S	N	Fabrício Vilarinho da Silva-GO_e_Leone Carvalho-GO	São Paulo	São Paulo-SP	Flamengo-RJ	SP	RJ	0	24/09	Morumbi	22h00	20712	80		16571	2	2	Marcos Mateus Pereira-MS	N	593800	276244.57	2014	24	0	1	0	0	1	0	3	12	2	12	0
Ricardo Marques Ribeiro-MG	S	N	N	Guilherme Dias Camilo-MG_e_Marcus Vinicius Gomes-MG	Florianópolis	Figueirense-SC	Corinthians-SP	SC	SP	0	24/09	Orlando Scarpelli	22h00	10245	100		10245	1	0	Anderson Daronco-RS	N	302335	243208.37	2014	24	1	0	0	0	0	1	17	6	17	3	0
Leandro Pedro Vuaden-RS	S	N	N	Marcelo Bertanha Barison-RS_e_José Javel Silveira-RS	Rio de Janeiro	Botafogo-RJ	Goiás-GO	RJ	GO	0	25/09	Maracanã	19h30	11611	51.6		5986	1	0	Fabrício Neves Correa-RS	N	127215	-47175.78	2014	24	1	0	0	0	0	1	11	9	13	9	0
Wilton Pereira Sampaio-GO	S	N	N	Cristhian Passos Sorence-GO_e_Bruno Pires-GO	São Paulo	Palmeiras-SP	Vitória-BA	SP	BA	0	25/09	Pacaembu	19h30	15430	96.6		14907	2	0	Renato Cardoso Conceição-MG	N	325605	62217.4	2014	24	1	0	0	0	0	1	18	18	20	16	0
Rodrigo D'Alonso Ferreira-SC	N	S	N	Alessandro Álvaro Rocha Mattos-BA_e_Ângelo Rudimar Bechi-SC	Belo Horizonte	Atlético Mineiro-MG	Santos-SP	MG	SP	0	25/09	Independência	20h30	19792	84.7		16772	3	2	Devarly do Rosário-ES	N	306245	99019.5	2014	24	1	0	0	0	0	1	5	8	7	8	0
Marielson Alves Silva-BA	N	S	S	Alessandro Álvaro Rocha Mattos-BA_e_Cleriston Clay Barreto Rios-SE	São Lourenço da Mata	Sport-PE	Cruzeiro-MG	PE	MG	0	27/09	Arena Pernambuco	18h30	29215	76.2		22248	0	0	Charles Hebert Cavalcante Ferreira-AL	N	629325	485853.77	2014	25	0	1	0	0	1	0	9	1	10	1	1
Bráulio da Silva Machado-SC	N	S	N	Nadine Schramm Camara Bastos-SC_e_Rosnei Hoffmann Scherer-SC	Chapecó	Chapecoense-SC	Criciúma-SC	SC	SC	1	27/09	Arena Condá	18h30	4703	100		4703	1	1	Evandro Bender-SC	N	53220	16014.13	2014	25	0	1	0	0	1	0	16	20	14	20	1
Ricardo Marques Ribeiro-MG	S	N	N	Guilherme Dias Camilo-MG_e_Celso Luiz da Silva-MG	São Paulo	São Paulo-SP	Fluminense-RJ	SP	RJ	0	27/09	Morumbi	21h00	19870	80.9		16076	1	3	Renato Cardoso Conceição-MG	N	581420	271311.43	2014	25	0	0	1	1	0	0	3	4	3	4	1
Elmo Alves Resende Cunha-GO	N	S	N	Fabrício Vilarinho da Silva-GO_e_Bruno Pires-GO	Rio de Janeiro	Botafogo-RJ	Grêmio-RS	RJ	RS	0	28/09	Maracanã	16h00	16351	64		10462	0	2	Devarly do Rosário-ES	N	263010	27573.91	2014	25	0	0	1	1	0	0	13	6	11	7	1
Marcelo de Lima Henrique-RJ	S	S	N	Rodrigo Pereira Joia-RJ_e_Rodrigo F. Henrique Correa-RJ	Curitiba	Atlético Paranaense-PR	Corinthians-SP	PR	SP	0	28/09	Arena da Baixada	16h00	19667	100		19667	1	0	Pathrice Wallace Correa Maia-RJ	N	574945	234948.09	2014	25	1	0	0	0	0	1	9	6	13	6	1
Marcelo Aparecido Ribeiro de Souza-SP	N	S	N	Marcelo Carvalho Van Gasse-SP_e_Rogério Pablos Zanardo-SP	Belo Horizonte	Atlético Mineiro-MG	Vitória-BA	MG	BA	0	28/09	Independência	16h00	20941	99.7		20877	2	0	Leandro Bizzio Marinho-SP	N	421362.5	152684.62	2014	25	1	0	0	0	0	1	5	18	5	18	1
Leandro Pedro Vuaden-RS	S	N	N	José Javel Silveira-RS_e_José Eduardo Calza-RS	Salvador	Bahia-BA	Flamengo-RJ	BA	RJ	0	28/09	Arena Fonte Nova	16h00	36826	100		36826	2	1	Gilberto Rodrigues Castro Júnior-PE	N	1066013	644482.11	2014	25	1	0	0	0	0	1	12	14	14	12	1
Heber Roberto Lopes-SC	S	S	S	Bruno Boschilla-PR_e_Neuza Inês Back-SC	São Paulo	Santos-SP	Goiás-GO	SP	GO	0	28/09	Pacaembu	18h30	21487	45.1		9694	2	0	Cleisson Veloso Pereira-MG	N	225655	-37644.74	2014	25	1	0	0	0	0	1	8	9	8	9	1
Luiz Flávio de Oliveira-SP	N	S	N	Emerson Augusto de Carvalho-SP_e_Vicente Romano Neto-SP	Porto Alegre	Internacional-RS	Coritiba-PR	RS	PR	0	28/09	Beira-Rio	18h30	24522	100		24522	4	2	Rodrigo Guarizo Ferreira do Amaral-SP	N	696810	463213.31	2014	25	1	0	0	0	0	1	2	17	2	16	1
Dewson Fernando Freitas da Silva-PA	N	S	N	Fábio Pereira-TO_e_Márcio Gleidson Correia Dias-PA	Florianópolis	Figueirense-SC	Palmeiras-SP	SC	SP	0	28/09	Orlando Scarpelli	18h30	6787	100		6787	3	1	Fábio Filipus-PR	N	139320	96955.38	2014	25	1	0	0	0	0	1	14	18	17	18	1
Leandro Pedro Vuaden-RS	S	N	N	José Antônio Chaves Franco Filho-RS_e_José Javel Silveira-RS	São Paulo	Palmeiras-SP	Chapecoense-SC	SP	SC	0	02/10	Pacaembu	19h30	14846	96.3		14299	4	2	Wagner do Nascimento Magalhães-RJ	N	304500	47592.6	2014	26	1	0	0	0	0	1	18	16	18	16	0
Marielson Alves Silva-DF	N	S	N	Alessandro Álvaro Rocha Mattos-BA_e_Luiz Carlos Silva Teixeira-BA	Rio de Janeiro	Flamengo-RJ	Santos-SP	RJ	SP	0	04/10	Maracanã	16h20	40530	91.8		37204	0	1	Eduardo Cordeiro Guimarães-RJ	N	1340195	385771.44	2014	26	0	0	1	1	0	0	14	8	14	8	1
Anderson Daronco-RS	N	N	N	Rafael da Silva Alves-RS_e_Marcelo Bertanha Barison-RS	Brasília	Fluminense-RJ	Bahia-BA	RJ	BA	0	04/10	Mané Garrincha	16h20	9476	100		9476	1	1	Rodrigo Batista Raposo-DF	N	626140	29145.55	2014	26	0	1	0	0	1	0	4	11	4	12	1
Ricardo Marques Ribeiro-MG	S	N	N	Luiz H. Souza Santos Renesto-PR_e_Luciano Roggenbaum-PR	Curitiba	Coritiba-PR	Atlético Paranaense-PR	PR	PR	1	04/10	Couto Pereira	16h20	18327	100		18327	1	0	Rafael Traci-PR	N	457034	158752.64	2014	26	1	0	0	0	0	1	16	10	17	9	1
Sandro Meira Ricci-PE	S	N	N	Clóvis Amaral da Silva-PE_e_Albino Andrade Albert Júnior-PE	Salvador	Vitória-BA	Botafogo-RJ	BA	RJ	0	04/10	Manoel Barradas (Barradão)	16h20	9816	96.8		9505	2	1	Emerson Sobral-PE	N	97129	14634.65	2014	26	1	0	0	0	0	1	19	13	18	13	1
Felipe Gomes da Silva-PR	N	S	N	Bruno Boschilla-PR_e_Ivan Carlos Bohn-PR	Porto Alegre	Grêmio-RS	São Paulo-SP	RS	SP	0	04/10	Arena do Grêmio	16h20	43653	100		43653	0	1	Fábio Filipus-PR	N	1667434	1400795.97	2014	26	0	0	1	1	0	0	7	3	6	3	1
Bráulio da Silva Machado-SC	N	S	N	Nadine Schramm Camara Bastos-SC_e_Carlos Berkenbrock-SC	São Paulo	Corinthians-SP	Sport-PE	SP	PE	0	04/10	Arena Corinthians	18h30	29238	100		29238	3	0	Leandro Bizzio Marinho-SP	N	1650086.5	930978.09	2014	26	1	0	0	0	0	1	5	11	6	9	1
Marcelo de Lima Henrique-RJ	S	S	S	Emerson Augusto de Carvalho-SP_e_Marcelo Carvalho Van Gasse-SP	Belo Horizonte	Cruzeiro-MG	Internacional-RS	MG	RS	0	04/10	Mineirão	18h30	52208	99.5		51944	2	1	Guilherme Ceretta de Lima-SP	N	2948985	325864.65	2014	26	1	0	0	0	0	1	1	2	1	2	1
Francisco Carlos Nascimento-AL	S	S	N	Fabrício Vilarinho da Silva-GO_e_Bruno Pires-GO	Criciúma	Criciúma-SC	Atlético Mineiro-MG	SC	MG	0	04/10	Heriberto Hulse	18h30	8309	100		8309	3	1	Fabrício Nery Trindade-GO	N	101540	61957.48	2014	26	1	0	0	0	0	1	20	6	20	5	1
Marcelo Aparecido Ribeiro de Souza-SP	N	N	N	Rogério Pablos Zanardo-SP_e_Anderson José de Moraes Coelho-SP	Goiânia	Goiás-GO	Figueirense-SC	GO	SC	0	04/10	Serra Dourada	21h00	2306	100		2306	1	0	Rafael Diniz-DF	N	25680	-2993.61	2014	26	1	0	0	0	0	1	9	15	9	14	1
Fabrício Neves Correa-RS	N	S	N	Fabrício Vilarinho da Silva-GO_e_José Antônio Chaves Franco Filho-RS	Rio de Janeiro	Botafogo-RJ	Palmeiras-SP	RJ	SP	0	08/10	Maracanã	19h30	12652	72.1		9123	0	1	Wagner dos Santos Rosa-RJ	N	218760	9518.89	2014	27	0	0	1	1	0	0	16	18	13	18	0
Jaílson Macedo Freitas-BA	N	N	N	Luiz Carlos Silva Teixeira-BA_e_Marcos W. Rocha de Amorim-BA	São Paulo	São Paulo-SP	Atlético Paranaense-PR	SP	PR	0	08/10	Morumbi	19h30	13899	70.5		9795	1	0	Luiz Flávio de Oliveira-SP	N	291750	58160.2	2014	27	1	0	0	0	0	1	2	13	3	10	0
Sandro Meira Ricci-PE	S	S	N	Cleriston Clay Barreto Rios-SE_e_Clóvis Amaral da Silva-PE	Curitiba	Coritiba-PR	Criciúma-SC	PR	SC	0	08/10	Couto Pereira	19h30	10930	100		10930	1	0	Adriano Milczvski-PR	N	162668.5	53313.94	2014	27	1	0	0	0	0	1	13	20	16	20	0
Péricles Bassols Pegado Cortez-RJ	S	S	N	Rodrigo Pereira Joia-RJ_e_Gilberto Stina Pereira-RJ	Salvador	Vitória-BA	Goiás-GO	BA	GO	0	08/10	Manoel Barradas (Barradão)	21h00	9260	91		8422	2	2	Johnn Herbert Alves Bispo-BA	N	72075	-3185.86	2014	27	0	1	0	0	1	0	19	9	19	9	0
Leandro Pedro Vuaden-RS	S	S	S	Alessandro Álvaro Rocha Mattos-BA_e_Kléber Lúcio Gil-SC	Belo Horizonte	Cruzeiro-MG	Corinthians-SP	MG	SP	0	08/10	Mineirão	22h00	33029	99.8		32958	0	1	Igor Junio Benevenuto-MG	N	1509747	-88469.16	2014	27	0	0	1	1	0	0	1	3	1	5	0
Marcelo de Lima Henrique-RJ	S	N	N	Rodrigo F. Henrique Correa-RJ_e_Luiz Cláudio Regazone-RJ	Porto Alegre	Grêmio-RS	Sport-PE	RS	PE	0	08/10	Arena do Grêmio	22h00	11659	100		11659	2	0	Francisco de Paula dos Santos Silva Neto-RS	N	247559	167738.87	2014	27	1	0	0	0	0	1	6	12	7	11	0
Flávio Rodrigues Guerra-SP	N	S	S	Emerson Augusto de Carvalho-SP_e_Marcelo Carvalho Van Gasse-SP	Florianópolis	Figueirense-SC	Flamengo-RJ	SC	RJ	0	08/10	Orlando Scarpelli	22h00	15727	100		15727	1	2	Jefferson Schmidt-SC	N	437350	362724.62	2014	27	0	0	1	1	0	0	16	10	15	14	0
Heber Roberto Lopes-SC	S	N	S	Carlos Berkenbrock-SC_e_Nadine Schramm Camara Bastos-SC	Rio de Janeiro	Fluminense-RJ	Atlético Mineiro-MG	RJ	MG	0	09/10	Maracanã	19h30	16401	62.9		10320	0	0	Pathrice Wallace Correa Maia-RJ	N	248565	48859.79	2014	27	0	1	0	0	1	0	5	8	4	6	0
Jean Pierre Gonçalves Lima-RS	N	N	N	Rafael da Silva Alves-RS_e_Lúcio Beiersdorf Flor-RS	Santos	Santos-SP	Bahia-BA	SP	BA	0	09/10	Vila Belmiro	19h30	7042	87.8		6184	1	0	Leandro Bizzio Marinho-SP	N	141420	20863.44	2014	27	1	0	0	0	0	1	7	15	8	11	0
Ricardo Marques Ribeiro-MG	S	S	N	Janette Mara Arcanjo-MG_e_Guilherme Dias Camilo-MG	Chapecó	Chapecoense-SC	Internacional-RS	SC	RS	0	09/10	Arena Condá	20h30	17230	100		17230	5	0	Evandro Bender-SC	N	651825	547509.03	2014	27	1	0	0	0	0	1	10	4	16	2	0
Leandro Pedro Vuaden-RS	S	N	N	Rafael da Silva Alves-RS_e_Marcelo Bertanha Barison-RS	São Paulo	Corinthians-SP	Botafogo-RJ	SP	RJ	0	01/06	Arena Corinthians	16h00	37119	100		37119	1	1	Thiago Duarte Peixoto-SP	N	2616819.5	1739872.76	2014	28	0	1	0	0	1	0	4	16	3	16	1
Flávio Rodrigues Guerra-SP	N	N	N	Anderson José de Moraes Coelho-SP_e_Carlos Augusto Nogueira Júnior-SP	Goiânia	Goiás-GO	Coritiba-PR	GO	PR	0	11/10	Serra Dourada	18h30	1392	100		1392	3	0	Cléber Vaz-GO	N	31370	2398.05	2014	28	1	0	0	0	0	1	9	18	9	13	1
Sandro Meira Ricci-PE	S	S	N	Cleriston Clay Barreto Rios-SE_e_Clóvis Amaral da Silva-PE	São Paulo	Palmeiras-SP	Grêmio-RS	SP	RS	0	11/10	Pacaembu	21h00	27407	98.3		26940	2	1	Marcelo Prieto Alfieri-SP	N	647130	304995.89	2014	28	1	0	0	0	0	1	15	7	18	6	1
Francisco Carlos Nascimento-AL	S	S	S	Fabrício Vilarinho da Silva-GO_e_Fábio Pereira-TO	Rio de Janeiro	Flamengo-RJ	Cruzeiro-MG	RJ	MG	0	12/10	Maracanã	16h00	46634	78.6		36645	3	0	Bruno Arleu de Araújo-RJ	N	1408615	423656.45	2014	28	1	0	0	0	0	1	10	1	10	1	1
Marielson Alves Silva-BA	N	N	N	Luiz Carlos Silva Teixeira-BA_e_Adson Márcio Lopes Leal-BA	Belo Horizonte	Atlético Mineiro-MG	São Paulo-SP	MG	SP	0	12/10	Independência	16h00	18517	82.6		15288	1	0	Wanderson Alves de Souza-MG	N	331030	113921.8	2014	28	1	0	0	0	0	1	5	2	8	2	1
Flávio Rodrigues de Souza-SP	N	N	N	Rogério Pablos Zanardo-SP_e_Herman Brumel Vani-SP	Salvador	Bahia-BA	Chapecoense-SC	BA	SC	0	12/10	Arena Fonte Nova	16h00	22162	100		22162	0	1	Arilson Bispo da Anunciação-BA	N	530985	236839.91	2014	28	0	0	1	1	0	0	13	11	15	10	1
Raphael Claus-SP	N	S	S	Emerson Augusto de Carvalho-SP_e_Alessandro Álvaro Rocha Mattos-BA	Porto Alegre	Internacional-RS	Fluminense-RJ	RS	RJ	0	12/10	Beira-Rio	16h00	24655	100		24655	2	1	Diego Almeida Real-RS	N	887105	661595.21	2014	28	1	0	0	0	0	1	2	5	4	5	1
Leandro Pedro Vuaden-RS	S	N	N	Marcelo Bertanha Barison-RS_e_José Antônio Chaves Franco Filho-RS	Recife	Sport-PE	Vitória-BA	PE	BA	0	12/10	Ilha do Retiro	18h30	14830	73.5		10895	1	2	Gilberto Rodrigues Castro Júnior-PE	N	208710	142228.44	2014	28	0	0	1	1	0	0	13	16	12	19	1
Marcelo de Lima Henrique-RJ	S	N	N	Rodrigo F. Henrique Correa-RJ_e_Gilberto Stina Pereira-RJ	Curitiba	Atlético Paranaense-PR	Figueirense-SC	PR	SC	0	12/10	Arena da Baixada	18h30	14185	100		14185	3	0	Adriano Milczvski-PR	N	207430	-32788.34	2014	28	1	0	0	0	0	1	12	19	13	16	1
Péricles Bassols Pegado Cortez-RJ	S	S	N	Rodrigo Pereira Joia-RJ_e_Luiz Cláudio Regazone-RJ	Criciúma	Criciúma-SC	Santos-SP	SC	SP	0	12/10	Heriberto Hulse	18h30	9076	100		9076	3	0	Jefferson Schmidt-SC	N	119875	78148.44	2014	28	1	0	0	0	0	1	20	8	20	7	1
Marcelo Aparecido Ribeiro de Souza-SP	N	N	N	Carlos Augusto Nogueira Júnior-SP_e_Anderson José de Moraes Coelho-SP	Rio de Janeiro	Fluminense-RJ	Criciúma-SC	RJ	SC	0	18/10	Maracanã	18h30	13408	83.6		11214	4	2	Rodrigo Carvalhães de Miranda-RJ	N	310005	63630.04	2014	29	1	0	0	0	0	1	6	20	5	20	1
Marcelo de Lima Henrique-RJ	S	S	N	Rodrigo Pereira Joia-RJ_e_Rodrigo F. Henrique Correa-RJ	São Paulo	São Paulo-SP	Bahia-BA	SP	BA	0	18/10	Morumbi	18h30	24871	88.3		21961	2	1	Leandro Bizzio Marinho-SP	N	793340	425845.29	2014	29	1	0	0	0	0	1	2	14	2	13	1
Marielson Alves Silva-BA	N	N	N	Adson Márcio Lopes Leal-BA_e_Luiz Carlos Silva Teixeira-BA	Goiânia	Goiás-GO	Grêmio-RS	GO	RS	0	18/10	Serra Dourada	18h30	3044	100		3044	0	0	Eduardo Tomaz de Aquino Valadão-GO	N	66585	25970.21	2014	29	0	1	0	0	1	0	9	8	9	7	1
Francisco Carlos Nascimento-AL	S	S	S	Fábio Pereira-TO_e_Cleriston Clay Barreto Rios-SE	Belo Horizonte	Atlético Mineiro-MG	Chapecoense-SC	MG	SC	0	18/10	Independência	21h00	20615	99.7		20558	1	0	Emerson de Almeida Ferreira-MG	N	546882.5	245130.83	2014	29	1	0	0	0	0	1	5	12	5	11	1
Flávio Rodrigues de Souza-SP	N	N	N	Rogério Pablos Zanardo-SP_e_Vicente Romano Neto-SP	São Paulo	Palmeiras-SP	Santos-SP	SP	SP	1	19/10	Pacaembu	16h00	31050	98.9		30695	1	3	José Cláudio Rocha Filho-SP	N	702450	351440.38	2014	29	0	0	1	1	0	0	18	7	15	8	1
Jean Pierre Gonçalves Lima-RS	N	N	N	Marcelo Bertanha Barison-RS_e_José Antônio Chaves Franco Filho-RS	Curitiba	Atlético Paranaense-PR	Flamengo-RJ	PR	RJ	0	19/10	Arena da Baixada	16h00	18908	100		18908	2	1	Adriano Milczvski-PR	N	540615	221854.6	2014	29	1	0	0	0	0	1	10	11	12	10	1
Dewson Fernando Freitas da Silva-PA	N	S	N	Kléber Lúcio Gil-SC_e_Carlos Berkenbrock-SC	Porto Alegre	Internacional-RS	Corinthians-SP	RS	SP	0	19/10	Beira-Rio	16h00	33641	100		33641	1	2	Márcio C. Brum Coruja-RS	N	1439260	1149738.37	2014	29	0	0	1	1	0	0	3	3	2	4	1
Péricles Bassols Pegado Cortez-RJ	S	N	N	Luiz Antônio Muniz de Oliveira-RJ_e_Michael Corrêia-RJ	Florianópolis	Figueirense-SC	Coritiba-PR	SC	PR	0	19/10	Orlando Scarpelli	16h00	4126	100		4126	4	0	Evandro Bender-SC	N	63370	32359.03	2014	29	1	0	0	0	0	1	14	19	19	18	1
Ricardo Marques Ribeiro-MG	S	S	N	Márcio Eustáquio Santiago-MG_e_Celso Luiz da Silva-MG	Volta Redonda	Botafogo-RJ	Sport-PE	RJ	PE	0	19/10	Raulino de Oliveira	18h30	13400	17.8		2384	1	1	João Batista de Arruda-RJ	N	33490	-57289.87	2014	29	0	1	0	0	1	0	16	13	16	13	1
Raphael Claus-SP	N	S	N	Emerson Augusto de Carvalho-SP_e_Herman Brumel Vani-SP	Salvador	Vitória-BA	Cruzeiro-MG	BA	MG	0	19/10	Manoel Barradas (Barradão)	18h30	20178	91		18366	0	1	Rafael Luís de Almeida Santos-BA	N	176436	70555.7	2014	29	0	0	1	1	0	0	17	1	16	1	1
Elmo Alves Resende Cunha-GO	N	N	N	Márcio Luiz Augusto-SP_e_Cristhian Passos Sorence-GO	Salvador	Bahia-BA	Atlético Mineiro-MG	BA	MG	0	21/10	Arena Fonte Nova	21h50	5961	100		5961	1	1	Manoel Nunes Lopo Garrido-BA	N	149435	-56517.24	2014	30	0	1	0	0	1	0	16	5	14	5	0
Thiago Duarte Peixoto-SP	N	S	S	Emerson Augusto de Carvalho-SP_e_Marcelo Carvalho Van Gasse-SP	Rio de Janeiro	Flamengo-RJ	Internacional-RS	RJ	RS	0	22/10	Maracanã	19h30	21283	88.8		18898	2	0	Daniel de Souza Macedo-RJ	N	644705	116835.42	2014	30	1	0	0	0	0	1	11	6	11	3	0
Alinor Silva da Paixão-MT	N	S	N	Fábio Pereira-TO_e_Fábio Rodrigo Rubinho-MT	Cuiabá	Corinthians-SP	Vitória-BA	SP	BA	0	22/10	Arena Pantanal	19h30	6116	100		6116	2	1	Daniel Martins dos Santos-MT	N	478500	371355.88	2014	30	1	0	0	0	0	1	2	18	3	17	0
Péricles Bassols Pegado Cortez-RJ	S	N	N	Rodrigo F. Henrique Correa-RJ_e_Luiz Cláudio Regazone-RJ	Belo Horizonte	Cruzeiro-MG	Palmeiras-SP	MG	SP	0	22/10	Mineirão	19h30	26946	100		26944	1	1	Renato Cardoso Conceição-MG	N	1122208	155558.26	2014	30	0	1	0	0	1	0	1	16	1	18	0
Ricardo Marques Ribeiro-MG	S	N	N	Celso Luiz da Silva-MG_e_Marcus Vinicius Gomes-MG	Criciúma	Criciúma-SC	Atlético Paranaense-PR	SC	PR	0	22/10	Heriberto Hulse	19h30	7641	100		7641	0	1	Carlos Eduardo Vieira Areas-SC	N	88110	50908.96	2014	30	0	0	1	1	0	0	20	10	20	10	0
Anderson Daronco-RS	N	N	N	Rafael da Silva Alves-RS_e_José Javel Silveira-RS	Curitiba	Coritiba-PR	Botafogo-RJ	PR	RJ	0	22/10	Couto Pereira	21h00	8106	100		8106	2	0	Adriano Milczvski-PR	N	116175.5	92447.56	2014	30	1	0	0	0	0	1	13	18	19	16	0
Vinícius Furlan-SP	N	N	N	Rogério Pablos Zanardo-SP_e_Vicente Romano Neto-SP	Porto Alegre	Grêmio-RS	Figueirense-SC	RS	SC	0	22/10	Arena do Grêmio	21h00	16979	100		16979	1	0	Luís Teixeira Rocha-RS	N	364664	270552.25	2014	30	1	0	0	0	0	1	7	13	8	14	0
Francisco Carlos Nascimento-AL	S	S	N	Kléber Lúcio Gil-SC_e_Carlos Berkenbrock-SC	Santos	Santos-SP	Fluminense-RJ	SP	RJ	0	22/10	Vila Belmiro	22h00	7653	80.7		6178	0	1	Flávio Rodrigues de Souza-SP	N	142010	15929.19	2014	30	0	0	1	1	0	0	8	4	7	6	0
Wagner do Nascimento Magalhães-RJ	N	S	N	Alessandro Álvaro Rocha Mattos-BA_e_Dibert Pedrosa Moisés-RJ	Chapecó	Chapecoense-SC	São Paulo-SP	SC	SP	0	22/10	Arena Condá	22h00	15095	100		15095	0	0	Evandro Bender-SC	N	385590	310590.63	2014	30	0	1	0	0	1	0	12	2	12	2	0
Marcelo de Lima Henrique-RJ	S	S	N	Rodrigo Pereira Joia-RJ_e_Gilberto Stina Pereira-RJ	Recife	Sport-PE	Goiás-GO	PE	GO	0	22/10	Ilha do Retiro	22h30	12639	61.6		7780	0	1	Nielson Nogueira Dias-PE	N	141335	87635.99	2014	30	0	0	1	1	0	0	13	9	13	9	0
Marielson Alves Silva-BA	N	S	N	Alessandro Álvaro Rocha Mattos-BA_e_Luiz Carlos Silva Teixeira-BA	Rio de Janeiro	Fluminense-RJ	Atlético Paranaense-PR	RJ	PR	0	25/10	Maracanã	16h20	20450	92.2		18845	2	1	Daniel de Souza Macedo-RJ	N	491475	166691	2014	31	1	0	0	0	0	1	3	10	4	10	1
Flávio Rodrigues Guerra-SP	N	S	N	Marcelo Carvalho Van Gasse-SP_e_Vicente Romano Neto-SP	São Paulo	Palmeiras-SP	Corinthians-SP	SP	SP	1	25/10	Pacaembu	16h20	24770	97.9		24245	1	1	Marcelo Prieto Alfieri-SP	N	548062.5	196375.99	2014	31	0	1	0	0	1	0	16	3	16	2	1
Pablo dos Santos Alves-ES	N	N	N	Cristhian Passos Sorence-GO_e_Leonardo Mendonça-ES	Florianópolis	Figueirense-SC	Cruzeiro-MG	SC	MG	0	25/10	Orlando Scarpelli	16h20	7843	100		7843	1	1	Ronan Marques da Rosa-SC	N	137310	98650.86	2014	31	0	1	0	0	1	0	13	1	13	1	1
Dewson Fernando Freitas da Silva-PA	N	S	N	Cleriston Clay Barreto Rios-SE_e_Márcio Gleidson Correia Dias-PA	Curitiba	Coritiba-PR	Grêmio-RS	PR	RS	0	25/10	Couto Pereira	18h30	13039	100		13039	1	1	Fábio Filipus-PR	N	287116.5	41588.48	2014	31	0	1	0	0	1	0	15	7	13	7	1
Felipe Gomes da Silva-PR	N	S	N	Bruno Boschilla-PR_e_Anderson José de Moraes Coelho-SP	Belo Horizonte	Atlético Mineiro-MG	Sport-PE	MG	PE	0	25/10	Independência	18h30	16382	80.1		13115	3	2	Wanderson Alves de Souza-MG	N	262095	77170.88	2014	31	1	0	0	0	0	1	5	13	5	13	1
Leandro Pedro Vuaden-RS	S	N	N	Rafael da Silva Alves-RS_e_José Javel Silveira-RS	Salvador	Vitória-BA	Criciúma-SC	BA	SC	0	25/10	Manoel Barradas (Barradão)	18h30	9967	84		8374	3	1	Arilson Bispo da Anunciação-BA	N	72825	5318.56	2014	31	1	0	0	0	0	1	16	20	18	20	1
Anderson Daronco-RS	N	N	N	Rodrigo F. Henrique Correa-RJ_e_Marrubson Melo Freitas-DF	Chapecó	Chapecoense-SC	Santos-SP	SC	SP	0	25/10	Arena Condá	18h30	10334	100		10334	1	1	Célio Amorim-SC	N	172650	121844.83	2014	31	0	1	0	0	1	0	12	8	12	8	1
